Out of the Past,1947,12,97,"Crime, Drama, Film-Noir",8,"A private eye escapes his past to run a gas station in a small town, but his past catches up with him. Now he must return to the big city world of danger, corruption, double crosses and duplicitous dames.",Jacques Tourneur,,,,,,,
"Rome, Open City",1945,12,103,"Drama, Thriller, War",8,"During the Nazi occupation of Rome in 1944, the Resistance leader, Giorgio Manfredi, is chased by the Nazis as he seeks refuge and a way to escape.",Roberto Rossellini,,,,,,,
Mildred Pierce,1945,12,111,"Crime, Drama, Film-Noir",8,A hard-working mother inches towards disaster as she divorces her husband and starts a successful restaurant business to support her spoiled daughter.,Michael Curtiz,,,,,,,
Brief Encounter,1945,12,86,"Drama, Romance",8,"Meeting a stranger in a railway station, a woman is tempted to cheat on her husband.",David Lean,,,,,,,
The Maltese Falcon,1941,12,100,"Crime, Film-Noir, Mystery",8,"San Francisco private detective Sam Spade takes on a case that involves him with three eccentric criminals, a gorgeous liar, and their quest for a priceless statuette, with the stakes rising after his partner is murdered.",John Huston,,,,,,,
The Cabinet of Dr. Caligari,1920,12,58,"Horror, Mystery, Thriller",8,"Hypnotist Dr. Caligari uses a somnambulist, Cesare, to commit murders.",Robert Wiene,,,,,,,
Knives Out,2019,12,130,"Comedy, Crime, Drama",7.9,"A detective investigates the death of the patriarch of an eccentric, combative family.",Rian Johnson,,,,,,,
Shoplifters,2018,15,121,"Crime, Drama",7.9,A family of small-time crooks take in a child they find outside in the cold.,Hirokazu Koreeda,,,,,,,
Marriage Story,2019,15,137,"Drama, Romance",7.9,Noah Baumbach's incisive and compassionate look at a marriage breaking up and a family staying together.,Noah Baumbach,,,,,,,
Super 30,2019,12,154,"Biography, Drama",7.9,Based on the life of Patna-based mathematician Anand Kumar who runs the famed Super 30 program for IIT aspirants in Patna.,Vikas Bahl,,,,,,,
Padman,2018,12,140,"Biography, Comedy, Drama",7.9,"Upon realizing the extent to which women are affected by their menses, a man sets out to create a sanitary pad machine and to provide inexpensive sanitary pads to the women of rural India.",R. Balki,,,,,,,
Airlift,2016,12,130,"Action, Drama, History",7.9,"When Iraq invades Kuwait in August 1990, a callous Indian businessman becomes the spokesperson for more than 170,000 stranded countrymen.",Raja Menon,,,,,,,
M.S. Dhoni: The Untold Story,2016,8,184,"Biography, Drama, Sport",7.9,The untold story of 's journey from ticket collector to trophy collector - the world-cup-winning captain of the Indian Cricket Team.,Neeraj Pandey,,,,,,,
Baby,2015,15,159,"Action, Crime, Thriller",7.9,"An elite counter-intelligence unit learns of a plot, masterminded by a maniacal madman. With the clock ticking, it's up to them to track the terrorists' international tentacles and prevent them from striking at the heart of India.",Neeraj Pandey,,,,,,,
Sing Street,2016,12,106,"Comedy, Drama, Music",7.9,A boy growing up in Dublin during the 1980s escapes his strained family life by starting a band to impress the mysterious girl he likes.,John Carney,,,,,,,
Thor: Ragnarok,2017,12,130,"Action, Adventure, Comedy",7.9,"Imprisoned on the planet Sakaar, Thor must race against time to return to Asgard and stop Ragnarök, the destruction of his world, at the hands of the powerful and ruthless villain Hela.",Taika Waititi,,,,,,,
Jojo Rabbit,2019,12,108,"Comedy, Drama, War",7.9,A young German boy in the Hitler Youth whose hero and imaginary friend is the country's dictator is shocked to discover that his mother is hiding a Jewish girl in their home.,Taika Waititi,,,,,,,
Wonder,2017,8,113,"Drama, Family",7.9,"Based on the New York Times bestseller, this movie tells the incredibly inspiring and heartwarming story of August Pullman, a boy with facial differences who enters the fifth grade, attending a mainstream elementary school for the first time.",Stephen Chbosky,,,,,,,
Arrival,2016,12,116,"Drama, Mystery, Sci-Fi",7.9,A linguist works with the military to communicate with alien lifeforms after twelve mysterious spacecraft appear around the world.,Denis Villeneuve,,,,,,,
Gully Boy,2019,12,154,"Drama, Music, Romance",7.9,A coming-of-age story based on the lives of street rappers in Mumbai.,Zoya Akhtar,,,,,,,
Short Term 12,2013,15,96,Drama,7.9,A 20-something supervising staff member of a residential treatment facility navigates the troubled waters of that world alongside her co-worker and longtime boyfriend.,Destin Daniel Cretton,,,,,,,
The Raid 2,2014,18,150,"Action, Crime, Thriller",7.9,"Only a short time after the first raid, Rama goes undercover with the thugs of Jakarta and plans to bring down the syndicate and uncover the corruption within his police force.",Gareth Evans,,,,,,,
Before Midnight,2013,15,109,"Drama, Romance",7.9,We meet Jesse and Celine nine years on in Greece. Almost two decades have passed since their first meeting on that train bound for Vienna.,Richard Linklater,,,,,,,
X-Men: Days of Future Past,2014,12,132,"Action, Adventure, Sci-Fi",7.9,The X-Men send Wolverine to the past in a desperate effort to change history and prevent an event that results in doom for both humans and mutants.,Bryan Singer,,,,,,,
The Batman,2022,15,176,"Action, Crime, Drama",7.9,"When a sadistic serial killer begins murdering key political figures in Gotham, Batman is forced to investigate the city's hidden corruption and question his family's involvement.",Matt Reeves,,,,,,,
Bohemian Rhapsody,2018,12,134,"Biography, Drama, Music",7.9,"The story of the legendary British rock band  and lead singer , leading up to their famous performance at  (1985).",Bryan Singer,,,,,,,
The Way He Looks,2014,12,96,"Drama, Romance",7.9,"Leonardo is a blind teenager searching for independence. His everyday life, the relationship with his best friend, Giovana, and the way he sees the world change completely with the arrival of Gabriel.",Daniel Ribeiro,,,,,,,
The Artist,2011,8,100,"Comedy, Drama, Romance",7.9,An egomaniacal film star develops a relationship with a young dancer against the backdrop of Hollywood's silent era.,Michel Hazanavicius,,,,,,,
Edge of Tomorrow,2014,12,113,"Action, Adventure, Sci-Fi",7.9,"A soldier fighting aliens gets to relive the same day over and over again, the day restarting every time he dies.",Doug Liman,,,,,,,
Amour,2012,12,127,Drama,7.9,"Georges and Anne are an octogenarian couple. They are cultivated, retired music teachers. Their daughter, also a musician, lives in Britain with her family. One day, Anne has a stroke, and the couple's bond of love is severely tested.",Michael Haneke,,,,,,,
About Elly,2009,12,119,"Drama, Mystery",7.9,The mysterious disappearance of a kindergarten teacher during a picnic in the north of Iran is followed by a series of misadventures for her fellow travelers.,Asghar Farhadi,,,,,,,
Dev.D,2009,15,144,"Comedy, Drama, Romance",7.9,"After breaking up with his childhood sweetheart, a young man finds solace in drugs. Meanwhile, a teenage girl is caught in the world of prostitution. Will they be destroyed, or will they find redemption?",Anurag Kashyap,,,,,,,
My Name Is Khan,2010,12,165,"Drama, Romance",7.9,An Indian Muslim man with Asperger's syndrome takes a challenge to speak to the President of the United States seriously and embarks on a cross-country journey.,Karan Johar,,,,,,,
The Breath,2009,15,128,"Action, Drama, Thriller",7.9,Story of 40-man Turkish task force who must defend a relay station.,Levent Semerci,,,,,,,
Let the Right One In,2008,15,114,"Drama, Fantasy, Horror",7.9,"Oskar, an overlooked and bullied boy, finds love and revenge through Eli, a beautiful but peculiar girl.",Tomas Alfredson,,,,,,,
District 9,2009,15,112,"Action, Sci-Fi, Thriller",7.9,Violence ensues after an extraterrestrial race forced to live in slum-like conditions on Earth finds a kindred spirit in a government agent exposed to their biotechnology.,Neill Blomkamp,,,,,,,
The Wrestler,2008,15,109,"Drama, Sport",7.9,"A faded professional wrestler must retire, but finds his quest for a new life outside the ring a dispiriting struggle.",Darren Aronofsky,,,,,,,
Jab We Met,2007,8,138,"Comedy, Drama, Romance",7.9,A depressed wealthy businessman finds his life changing after he meets a spunky and care-free young woman.,Imtiaz Ali,,,,,,,
Boyhood,2014,15,165,Drama,7.9,"The life of Mason, from early childhood to his arrival at college.",Richard Linklater,,,,,,,
The Worst Person in the World,2021,15,128,"Comedy, Drama, Romance",7.9,"The chronicles of four years in the life of Julie, a young woman who navigates the troubled waters of her love life and struggles to find her career path, leading her to take a realistic look at who she really is.",Joachim Trier,,,,,,,
"4 Months, 3 Weeks and 2 Days",2007,15,113,Drama,7.9,A woman assists her friend in arranging an illegal abortion in 1980s Romania.,Cristian Mungiu,,,,,,,
Star Trek,2009,12,127,"Action, Adventure, Sci-Fi",7.9,The brash James T. Kirk tries to live up to his father's legacy with Mr. Spock keeping him in check as a vengeful Romulan from the future creates black holes to destroy the Federation one planet at a time.,J.J. Abrams,,,,,,,
Dallas Buyers Club,2013,15,117,"Biography, Drama",7.9,"In 1985 Dallas, electrician and hustler Ron Woodroof works around the system to help AIDS patients get the medication they need after he is diagnosed with the disease.",Jean-Marc Vallée,,,,,,,
In Bruges,2008,18,107,"Comedy, Crime, Drama",7.9,"Guilt-stricken after a job gone wrong, hitman Ray and his partner await orders from their ruthless boss in Bruges, Belgium, the last place in the world Ray wants to be.",Martin McDonagh,,,,,,,
The Man from Earth,2007,8,87,"Drama, Fantasy, Mystery",7.9,An impromptu goodbye party for Professor John Oldman becomes a mysterious interrogation after the retiring scholar reveals to his colleagues he has a longer and stranger past than they can imagine.,Richard Schenkman,,,,,,,
Letters from Iwo Jima,2006,15,141,"Action, Adventure, Drama",7.9,"The story of the battle of Iwo Jima between the United States and Imperial Japan during World War II, as told from the perspective of the Japanese who fought it.",Clint Eastwood,,,,,,,
Life of Pi,2012,8,127,"Adventure, Drama, Fantasy",7.9,"A young man who survives a disaster at sea is hurtled into an epic journey of adventure and discovery. While cast away, he forms an unexpected connection with another survivor: a fearsome Bengal tiger.",Ang Lee,,,,,,,
Fantastic Mr. Fox,2009,8,87,"Animation, Adventure, Comedy",7.9,An urbane fox cannot resist returning to his farm raiding ways and then must help his community survive the farmers' retaliation.,Wes Anderson,,,,,,,
3-Iron,2004,15,88,"Crime, Drama, Romance",7.9,A transient young man breaks into empty homes to partake of the vacationing residents' lives for a few days.,Kim Ki-duk,,,,,,,
C.R.A.Z.Y.,2005,15,129,"Comedy, Drama",7.9,"A young French Canadian, one of five boys in a conservative family in the 1960s and 1970s, struggles to reconcile his emerging identity with his father's values.",Jean-Marc Vallée,,,,,,,
The Return,2003,12,110,Drama,7.9,"In the Russian wilderness, two brothers face a range of new, conflicting emotions when their father - a man they know only through a single photograph - resurfaces.",Andrey Zvyagintsev,,,,,,,
Iron Man,2008,12,126,"Action, Adventure, Sci-Fi",7.9,"After being held captive in an Afghan cave, billionaire engineer Tony Stark creates a unique weaponized suit of armor to fight evil.",Jon Favreau,,,,,,,
Shaun of the Dead,2004,15,99,"Comedy, Horror",7.9,"The uneventful, aimless lives of a London electronics salesman and his layabout roommate are disrupted by the zombie apocalypse.",Edgar Wright,,,,,,,
Kal Ho Naa Ho,2003,12,186,"Comedy, Drama, Musical",7.9,"Naina, an introverted, perpetually depressed girl's life changes when she meets Aman. But Aman has a secret of his own which changes their lives forever. Embroiled in all this is Rohit, Naina's best friend who conceals his love for her.",Nikkhil Advani,,,,,,,
Head-On,2004,18,121,"Drama, Romance",7.9,"With the intention to break free from the strict familial restrictions, a suicidal young woman sets up a marriage of convenience with a forty-year-old addict, an act that will lead to an outburst of envious love.",Fatih Akin,,,,,,,
Mystic River,2003,15,138,"Crime, Drama, Mystery",7.9,The lives of three men who were childhood friends are shattered when one of them has a family tragedy.,Clint Eastwood,,,,,,,
Harry Potter and the Prisoner of Azkaban,2004,8,142,"Adventure, Family, Fantasy",7.9,"Harry Potter, Ron and Hermione return to Hogwarts School of Witchcraft and Wizardry for their third year of study, where they delve into the mystery surrounding an escaped prisoner who poses a dangerous threat to the young wizard.",Alfonso Cuarón,,,,,,,
Hero,2002,12,120,"Action, Adventure, Drama",7.9,"A defense officer, Nameless, was summoned by the King of Qin regarding his success of terminating three warriors.",Yimou Zhang,,,,,,,
Talk to Her,2002,15,112,"Drama, Mystery, Romance",7.9,Two men share an odd friendship while they care for two women who are both in deep comas.,Pedro Almodóvar,,,,,,,
No Man's Land,2001,15,98,"Comedy, Drama, War",7.9,"Bosnia and Herzegovina during 1993 at the time of the heaviest fighting between the two warring sides. Two soldiers from opposing sides in the conflict, Nino and Ciki, become trapped in no man's land, whilst a third soldier becomes a living booby trap.",Danis Tanovic,,,,,,,
The Bourne Identity,2002,12,119,"Action, Mystery, Thriller",7.9,"A man is picked up by a fishing boat, bullet-riddled and suffering from amnesia, before racing to elude assassins and attempting to regain his memory.",Doug Liman,,,,,,,
Nine Queens,2000,15,114,"Crime, Drama, Thriller",7.9,"Two con artists try to swindle a stamp collector by selling him a sheet of counterfeit rare stamps (the ""nine queens"").",Fabián Bielinsky,,,,,,,
Children of Men,2006,15,109,"Action, Drama, Sci-Fi",7.9,"In 2027, in a chaotic world in which women have somehow become infertile, a former activist agrees to help transport a miraculously pregnant woman to a sanctuary at sea.",Alfonso Cuarón,,,,,,,
"Crouching Tiger, Hidden Dragon",2000,12,120,"Action, Adventure, Drama",7.9,A young Chinese warrior steals a sword from a famed swordsman and then escapes into a world of romantic adventure with a mysterious man in the frontier of the nation.,Ang Lee,,,,,,,
Almost Famous,2000,15,122,"Adventure, Comedy, Drama",7.9,A high-school boy in the early 1970s is given the chance to write a story for Rolling Stone magazine about an up-and-coming rock band as he accompanies them on their concert tour.,Cameron Crowe,,,,,,,
Dancer in the Dark,2000,15,140,"Crime, Drama, Musical",7.9,An Eastern European US immigrant with a love for musicals has to cope with the gradual loss of her vision.,Lars von Trier,,,,,,,
Mulholland Drive,2001,15,147,"Drama, Mystery, Thriller",7.9,"After a car wreck on the winding Mulholland Drive renders a woman amnesiac, she and a perky Hollywood-hopeful search for clues and answers across Los Angeles in a twisting venture beyond dreams and reality.",David Lynch,,,,,,,
Shrek,2001,4,90,"Animation, Adventure, Comedy",7.9,"A mean lord exiles fairytale creatures to the swamp of a grumpy ogre, who must go on a quest and rescue a princess for the lord in order to get his land back.",Andrew Adamson,,,,,,,
Toy Story 2,1999,4,92,"Animation, Adventure, Comedy",7.9,"When Woody is stolen by a toy collector, Buzz and his friends set out on a rescue mission to save Woody before he becomes a museum toy property with his roundup gang Jessie, Prospector, and Bullseye.",John Lasseter,,,,,,,
Titanic,1997,12,194,"Drama, Romance",7.9,"A seventeen-year-old aristocrat falls in love with a kind but poor artist aboard the luxurious, ill-fated R.M.S. Titanic.",James Cameron,,,,,,,
Boogie Nights,1997,18,155,Drama,7.9,"Back when sex was safe, pleasure was a business and business was booming, an idealistic porn producer aspires to elevate his craft to an art when he discovers a hot young talent.",Paul Thomas Anderson,,,,,,,
Whisper of the Heart,1995,4,111,"Animation, Drama, Family",7.9,"A love story between a girl who loves reading books, and a boy who has previously checked out all of the library books she chooses.",Yoshifumi Kondô,,,,,,,
Ghost in the Shell,1995,15,83,"Animation, Action, Crime",7.9,A cyborg policewoman and her partner hunt a mysterious and powerful hacker called the Puppet Master.,Mamoru Oshii,,,,,,,
Once Were Warriors,1994,18,102,"Crime, Drama",7.9,A family descended from Maori warriors is bedeviled by a violent father and the societal problems of being treated as outcasts.,Lee Tamahori,,,,,,,
True Romance,1993,18,119,"Crime, Drama, Romance",7.9,"In Detroit, a lonely pop culture geek marries a call girl, steals cocaine from her pimp, and tries to sell it in Hollywood. Meanwhile, the owners of the cocaine, the Mob, track them down in an attempt to reclaim it.",Tony Scott,,,,,,,
Three Colors: Blue,1993,15,94,"Drama, Music, Mystery",7.9,A woman struggles to find a way to live her life after the death of her husband and child.,Krzysztof Kieslowski,,,,,,,
The Nightmare Before Christmas,1993,8,76,"Animation, Family, Fantasy",7.9,"Jack Skellington, king of Halloween Town, discovers Christmas Town, but his attempts to bring Christmas to his home causes confusion.",Henry Selick,,,,,,,
Carlito's Way,1993,18,144,"Crime, Drama, Thriller",7.9,"A Puerto Rican former convict, just released from prison, pledges to stay away from drugs and violence despite the pressure around him and lead on to a better life outside of N.Y.C.",Brian De Palma,,,,,,,
"Blood In, Blood Out",1993,18,180,"Crime, Drama",7.9,"Based on the true life experiences of poet Jimmy Santiago Baca, the film focuses on step-brothers Paco and Cruz, and their bi-racial cousin Miklo.",Taylor Hackford,,,,,,,
Edward Scissorhands,1990,4,105,"Drama, Fantasy, Romance",7.9,"An artificial man, who was incompletely constructed and has scissors for hands, leads a solitary life. Then one day, a suburban lady meets him and introduces him to her world.",Tim Burton,,,,,,,
My Left Foot,1989,15,103,"Biography, Drama",7.9,", born with cerebral palsy, learns to paint and write with his only controllable limb - his left foot.",Jim Sheridan,,,,,,,
Do the Right Thing,1989,18,120,"Comedy, Drama",7.9,"On the hottest day of the year on a street in the Bedford-Stuyvesant section of Brooklyn, everyone's hate and bigotry smolders and builds until it explodes into violence.",Spike Lee,,,,,,,
The Untouchables,1987,15,119,"Crime, Drama, Thriller",7.9,"During the era of Prohibition in the United States, Federal Agent  sets out to stop ruthless Chicago gangster  and, because of rampant corruption, assembles a small, hand-picked team to help him.",Brian De Palma,,,,,,,
The Sacrifice,1986,12,149,Drama,7.9,"At the dawn of World War III, a man searches for a way to restore peace to the world and finds he must give something in return.",Andrei Tarkovsky,,,,,,,
Hannah and Her Sisters,1986,15,107,"Comedy, Drama",7.9,"Between two Thanksgivings two years apart, Hannah's husband falls in love with her sister Lee, while her hypochondriac ex-husband rekindles his relationship with her sister Holly.",Woody Allen,,,,,,,
Brazil,1985,15,132,"Drama, Sci-Fi",7.9,A bureaucrat in a dystopic society becomes an enemy of the state as he pursues the woman of his dreams.,Terry Gilliam,,,,,,,
This Is Spinal Tap,1984,15,82,"Comedy, Music",7.9,"Spinal Tap, one of England's loudest bands, is chronicled by film director Marty DiBergi on what proves to be a fateful tour.",Rob Reiner,,,,,,,
A Christmas Story,1983,8,93,"Comedy, Family",7.9,"In the 1940s, a young boy named Ralphie Parker attempts to convince his parents, teacher, and Santa Claus that a Red Ryder Range 200 Shot BB gun really is the perfect Christmas gift.",Bob Clark,,,,,,,
E.T. the Extra-Terrestrial,1982,4,115,"Adventure, Family, Sci-Fi",7.9,A troubled child summons the courage to help a friendly alien escape from Earth and return to his home planet.,Steven Spielberg,,,,,,,
Kagemusha,1980,12,180,"Drama, History, War",7.9,A petty thief with an utter resemblance to a samurai warlord is hired as the lord's double. When the warlord later dies the thief is forced to take up arms in his place.,Akira Kurosawa,,,,,,,
The Blues Brothers,1980,14,133,"Action, Adventure, Comedy",7.9,"Jake Blues rejoins with his brother Elwood after being released from prison, but the duo has just days to reunite their old R&B band and save the Catholic home where the two were raised, outrunning the police as they tear through Chicago.",John Landis,,,,,,,
Manhattan,1979,14,96,"Comedy, Drama, Romance",7.9,The life of a divorced television writer dating a teenage girl is further complicated when he falls in love with his best friend's mistress.,Woody Allen,,,,,,,
All the President's Men,1976,14,138,"Drama, History, Thriller",7.9,"""The Washington Post"" reporters  and  uncover the details of the Watergate scandal that leads to President 's resignation.",Alan J. Pakula,,,,,,,
Amarcord,1973,14,123,"Comedy, Drama",7.9,A series of comedic and nostalgic vignettes set in a 1930s Italian coastal town.,Federico Fellini,,,,,,,
Harold and Maude,1971,14,91,"Comedy, Drama, Romance",7.9,"Young, rich, and obsessed with death, Harold finds himself changed forever when he meets lively septuagenarian Maude at a funeral.",Hal Ashby,,,,,,,
Patton,1970,12,172,"Biography, Drama, War",7.9,The World War II phase of the career of controversial American general .,Franklin J. Schaffner,,,,,,,
The Conformist,1970,14,113,Drama,7.9,"A weak-willed Italian man becomes a fascist flunky who goes abroad to arrange the assassination of his old teacher, now a political dissident.",Bernardo Bertolucci,,,,,,,
The Wild Bunch,1969,18,145,"Action, Adventure, Western",7.9,"An aging group of outlaws look for one last big score as the ""traditional"" American West is disappearing around them.",Sam Peckinpah,,,,,,,
The Lion in Winter,1968,12,134,"Biography, Drama, History",7.9,"1183 A.D.: King Henry II's three sons all want to inherit the throne, but he won't commit to a choice. When he allows his imprisoned wife Eleanor of Aquitaine out for a Christmas visit, they all variously plot to force him into a decision.",Anthony Harvey,,,,,,,
In the Heat of the Night,1967,12,110,"Drama, Mystery, Thriller",7.9,"A black Philadelphia police detective is mistakenly suspected of a local murder while passing through a racially hostile Mississippi town, and after being cleared is reluctantly asked by the police chief to investigate the case.",Norman Jewison,,,,,,,
In Cold Blood,1967,14,134,"Biography, Crime, Drama",7.9,"Two ex-cons murder a family in a robbery attempt, before going on the run from the authorities. The police try to piece together the details of the murder in an attempt to track down the killers.",Richard Brooks,,,,,,,
Doctor Zhivago,1965,12,193,"Drama, Romance, War",7.9,"The life of a Russian physician and poet who, although married to another, falls in love with a political activist's wife and experiences hardship during World War I and then the October Revolution.",David Lean,,,,,,,
A Fistful of Dollars,1964,14,99,"Action, Drama, Western",7.9,"A wandering gunfighter plays two rival families against each other in a town torn apart by greed, pride, and revenge.",Sergio Leone,,,,,,,
Charade,1963,8,113,"Comedy, Mystery, Romance",7.9,Romance and suspense ensue in Paris as a woman is pursued by several men who want a fortune her murdered husband had stolen. Whom can she trust?,Stanley Donen,,,,,,,
Vivre Sa Vie,1962,14,83,Drama,7.9,Twelve episodic tales in the life of a Parisian woman and her slow descent into prostitution.,Jean-Luc Godard,,,,,,,
The Manchurian Candidate,1962,12,126,"Drama, Thriller",7.9,An American POW in the Korean War is brainwashed as an unwitting assassin for an international Communist conspiracy.,John Frankenheimer,,,,,,,
Spartacus,1960,8,197,"Adventure, Biography, Drama",7.9,"The slave Spartacus survives brutal training as a gladiator and leads a violent revolt against the decadent Roman Republic, as the ambitious Crassus seeks to gain power by crushing the uprising.",Stanley Kubrick,,,,,,,
Hiroshima Mon Amour,1959,14,90,"Drama, Romance",7.9,A French actress filming an anti-war film in Hiroshima has an affair with a married Japanese architect as they share their differing perspectives on war.,Alain Resnais,,,,,,,
Cat on a Hot Tin Roof,1958,14,108,Drama,7.9,Brick is an alcoholic ex-football player who drinks his days away and resists the affections of his wife. A reunion with his terminal father jogs a host of memories and revelations for both father and son.,Richard Brooks,,,,,,,
The Ten Commandments,1956,4,220,"Adventure, Drama, Family",7.9,"Moses, raised as a prince of Egypt in the Pharaoh's household, learns of his true heritage as a Hebrew and his divine mission as the deliverer of his people from slavery.",Cecil B. DeMille,,,,,,,
The Searchers,1956,8,119,"Adventure, Drama, Western",7.9,An American Civil War veteran embarks on a years-long journey to rescue his niece from the Comanches after the rest of his brother's family is massacred in a raid on their Texas farm.,John Ford,,,,,,,
The Big Heat,1953,14,89,"Crime, Film-Noir, Thriller",7.9,Tough cop Dave Bannion takes on a politically powerful crime syndicate.,Fritz Lang,,,,,,,
A Streetcar Named Desire,1951,14,122,Drama,7.9,Disturbed Blanche DuBois moves in with her sister in New Orleans and is tormented by her brutish brother-in-law while her reality crumbles around her.,Elia Kazan,,,,,,,
