Misery,1990,18,107,"Drama, Thriller",7.8,"After a famous author is rescued from a car crash by a fan of his novels, he comes to realize that the care he is receiving is only the beginning of a nightmare of captivity and abuse.",Rob Reiner,,,,,,,
Awakenings,1990,12,121,"Biography, Drama",7.8,"The victims of an encephalitis epidemic many years ago have been catatonic ever since, but now a new drug offers the prospect of reviving them.",Penny Marshall,,,,,,,
Kiki's Delivery Service,1989,4,103,"Animation, Adventure, Family",7.8,"A young witch, on her mandatory year of independent life, finds fitting into a new community difficult while she supports herself by running an air courier service.",Hayao Miyazaki,,,,,,,
Glory,1989,15,122,"Biography, Drama, History",7.8,"leads the U.S. Civil War's first all-black volunteer company, fighting prejudices from both his own Union Army, and the Confederates.",Edward Zwick,,,,,,,
The Killer,1989,18,111,"Action, Crime, Drama",7.8,A disillusioned assassin accepts one last hit in hopes of using his earnings to restore vision to a singer he accidentally blinded.,John Woo,,,,,,,
Crimes and Misdemeanors,1989,15,104,"Comedy, Drama",7.8,An ophthalmologist's mistress threatens to reveal their affair to his wife while a married documentary filmmaker is infatuated with another woman.,Woody Allen,,,,,,,
Back to the Future Part II,1989,8,108,"Adventure, Comedy, Sci-Fi",7.8,"After visiting 2015, Marty McFly must repeat his visit to 1955 to prevent disastrous changes to 1985...without interfering with his first trip.",Robert Zemeckis,,,,,,,
Mississippi Burning,1988,18,128,"Crime, Drama, History",7.8,Two F.B.I. Agents with wildly different styles arrive in Mississippi to investigate the disappearance of some civil rights activists.,Alan Parker,,,,,,,
Predator,1987,18,107,"Action, Adventure, Horror",7.8,A team of commandos on a mission in a Central American jungle find themselves hunted by an extraterrestrial warrior.,John McTiernan,,,,,,,
Ferris Bueller's Day Off,1986,15,103,Comedy,7.8,"A high school wise guy is determined to have a day off from school, despite what the Principal thinks of that.",John Hughes,,,,,,,
The Breakfast Club,1985,15,97,"Comedy, Drama",7.8,Five high school students meet in Saturday detention and discover how they have a lot more in common than they thought.,John Hughes,,,,,,,
The Killing Fields,1984,15,141,"Biography, Drama, History",7.8,"A journalist is trapped in Cambodia during tyrant 's bloody 'Year Zero' cleansing campaign, which claimed the lives of two million 'undesirable' civilians.",Roland Joffé,,,,,,,
Ghostbusters,1984,8,105,"Action, Comedy, Fantasy",7.8,"Three parapsychologists forced out of their university funding set up shop as a unique ghost removal service in New York City, attracting frightened yet skeptical customers.",Ivan Reitman,,,,,,,
The Right Stuff,1983,15,193,"Adventure, Biography, Drama",7.8,"The U.S. space program's development from the breaking of the sound barrier to selection of the Mercury 7 astronauts, from a group of test pilots with a more seat-of-the-pants approach than the program's more cautious engineers preferred.",Philip Kaufman,,,,,,,
The King of Comedy,1982,8,109,"Comedy, Crime, Drama",7.8,"Rupert Pupkin is a passionate yet unsuccessful comic who craves nothing more than to be in the spotlight and to achieve this, he stalks and kidnaps his idol to take the spotlight for himself.",Martin Scorsese,,,,,,,
Kramer vs. Kramer,1979,12,105,Drama,7.8,"After his wife leaves him, a work-obsessed Manhattan advertising executive is forced to learn long-neglected parenting skills, but a heated custody battle over the couple's young son deepens the wounds left by the separation.",Robert Benton,,,,,,,
All That Jazz,1979,14,123,"Drama, Music, Musical",7.8,"Director/choreographer  tells his own life story as he details the sordid career of Joe Gideon, a womanizing, drug-using dancer.",Bob Fosse,,,,,,,
Days of Heaven,1978,12,94,"Drama, Romance",7.8,A hot-tempered farm laborer convinces the woman he loves to marry their rich but dying boss so that they can have a claim to his fortune.,Terrence Malick,,,,,,,
Dawn of the Dead,1978,14,127,"Horror, Thriller",7.8,"Following an ever-growing epidemic of zombies that have risen from the dead, two Philadelphia S.W.A.T. team members, a traffic reporter, and his television executive girlfriend seek refuge in a secluded shopping mall.",George A. Romero,,,,,,,
The Outlaw Josey Wales,1976,18,135,Western,7.8,Missouri farmer Josey Wales joins a Confederate guerrilla unit and winds up on the run from the Union soldiers who murdered his family.,Clint Eastwood,,,,,,,
The Man Who Would Be King,1975,8,129,"Adventure, History, War",7.8,"Two former British soldiers in 1880s India decide to set themselves up as Kings in Kafiristan, a land where no white man has set foot since Alexander the Great.",John Huston,,,,,,,
The Holy Mountain,1973,14,114,"Adventure, Drama, Fantasy",7.8,"In a corrupt, greed-fueled world, a powerful alchemist leads a messianic character and seven materialistic figures to the Holy Mountain, where they hope to achieve enlightenment.",Alejandro Jodorowsky,,,,,,,
The Conversation,1974,14,113,"Drama, Mystery, Thriller",7.8,"A paranoid, secretive surveillance expert has a crisis of conscience when he suspects that the couple he is spying on will be murdered.",Francis Ford Coppola,,,,,,,
The Day of the Jackal,1973,12,143,"Crime, Drama, Thriller",7.8,"In the aftermath of France allowing Algeria's independence, a group of resentful military veterans hire a professional assassin codenamed ""Jackal"" to kill President Charles de Gaulle.",Fred Zinnemann,,,,,,,
The Discreet Charm of the Bourgeoisie,1972,14,102,Comedy,7.8,"A surreal, virtually plotless series of dreams centered around six middle-class people and their consistently interrupted attempts to have a meal together.",Luis Buñuel,,,,,,,
"Aguirre, the Wrath of God",1972,12,95,"Action, Adventure, Biography",7.8,"In the 16th century, the ruthless and insane Don Lope de Aguirre leads a Spanish expedition in search of El Dorado.",Werner Herzog,,,,,,,
Willy Wonka & the Chocolate Factory,1971,4,100,"Family, Fantasy, Musical",7.8,A poor but hopeful boy seeks one of the five coveted golden tickets that will send him on a tour of Willy Wonka's mysterious chocolate factory.,Mel Stuart,,,,,,,
Midnight Cowboy,1969,14,113,Drama,7.8,"A naive hustler travels from Texas to New York City to seek personal fortune, finding a new friend in the process.",John Schlesinger,,,,,,,
Night of the Living Dead,1968,14,96,"Horror, Thriller",7.8,A ragtag group of Pennsylvanians barricade themselves in an old farmhouse to remain safe from a horde of flesh-eating ghouls that are ravaging the East Coast of the United States.,George A. Romero,,,,,,,
Guess Who's Coming to Dinner,1967,4,108,"Comedy, Drama",7.8,A couple's attitudes are challenged when their daughter introduces them to her African-American fiancé.,Stanley Kramer,,,,,,,
The Umbrellas of Cherbourg,1964,12,91,"Drama, Musical, Romance",7.8,A young woman separated from her lover by war faces a life-altering decision.,Jacques Demy,,,,,,,
My Fair Lady,1964,4,170,"Drama, Family, Musical",7.8,"In 1910s London, snobbish phonetics professor Henry Higgins agrees to a wager that he can make crude flower girl Eliza Doolittle presentable in high society.",George Cukor,,,,,,,
Mary Poppins,1964,4,139,"Comedy, Family, Fantasy",7.8,"In turn of the century London, a magical nanny employs music and adventure to help two neglected children become closer to their father.",Robert Stevenson,,,,,,,
The Innocents,1961,14,100,Horror,7.8,A young governess for two children becomes convinced that the house and grounds are haunted.,Jack Clayton,,,,,,,
L'Avventura,1960,14,144,"Drama, Mystery, Romance",7.8,"A woman disappears during a Mediterranean boating trip. During the search, her lover and her best friend become attracted to each other.",Michelangelo Antonioni,,,,,,,
East of Eden,1955,12,118,Drama,7.8,"Two brothers in 1910s California struggle to maintain their strict, Bible-toting father's favor as an old secret about their long-absent mother comes to light.",Elia Kazan,,,,,,,
The Day the Earth Stood Still,1951,4,92,"Drama, Sci-Fi",7.8,"An alien lands in Washington, D.C. and tells the people of Earth that they must live peacefully or be destroyed as a danger to other planets.",Robert Wise,,,,,,,
The Asphalt Jungle,1950,8,112,"Crime, Drama, Film-Noir",7.8,"A major heist goes off as planned, but then double crosses, bad luck and solid police work cause everything to unravel.",John Huston,,,,,,,
Red River,1948,4,133,"Drama, Western",7.8,"Dunson leads a cattle drive, the culmination of over 14 years of work, to its destination in Missouri. But his tyrannical behavior along the way causes a mutiny, led by his adopted son.",Howard Hawks,,,,,,,
To Have and Have Not,1944,8,100,"Adventure, Comedy, Film-Noir",7.8,"During World War II, American expatriate Harry Morgan helps transport a French Resistance leader and his beautiful wife to Martinique while romancing a sensuous lounge singer.",Howard Hawks,,,,,,,
Gaslight,1944,12,114,"Crime, Drama, Mystery",7.8,"Ten years after her aunt was murdered in their London home, a woman returns from Italy in the 1880s to resume residence with her new husband. His obsessive interest in the home rises from a secret that may require driving his wife insane.",George Cukor,,,,,,,
Shadow of a Doubt,1943,12,108,"Film-Noir, Thriller",7.8,"A teenage girl, overjoyed when her favorite uncle comes to visit the family in their quiet California town, slowly begins to suspect that he is in fact the ""Merry Widow"" killer sought by the authorities.",Alfred Hitchcock,,,,,,,
His Girl Friday,1940,12,92,"Comedy, Drama, Romance",7.8,A newspaper editor uses every trick in the book to keep his ace reporter ex-wife from remarrying.,Howard Hawks,,,,,,,
Stagecoach,1939,4,96,"Adventure, Drama, Western",7.8,A group of people traveling on a stagecoach find their journey complicated by the threat of Geronimo and learn something about each other in the process.,John Ford,,,,,,,
You Can't Take It with You,1938,4,126,"Comedy, Drama, Romance",7.8,"The son of a snobbish Wall Street banker becomes engaged to a woman from a good-natured but decidedly eccentric family, not realizing that his father is trying to force her family from their home for a real estate development.",Frank Capra,,,,,,,
The Lady Vanishes,1938,12,96,"Mystery, Thriller",7.8,"While travelling in continental Europe, a rich young playgirl realizes that an elderly lady seems to have disappeared from the train.",Alfred Hitchcock,,,,,,,
A Night at the Opera,1935,4,96,"Comedy, Music, Musical",7.8,A sly business manager and the wacky friends of two opera singers in Italy help them achieve success in America while humiliating their stuffy and snobbish enemies.,Sam Wood,,,,,,,
Bride of Frankenstein,1935,12,75,"Drama, Horror, Sci-Fi",7.8,"reveals the main characters of her novel survived: Dr. Frankenstein, goaded by an even madder scientist, builds his monster a mate.",James Whale,,,,,,,
Duck Soup,1933,4,69,"Comedy, Musical",7.8,"Rufus T. Firefly is named the dictator of bankrupt Freedonia and declares war on neighboring Sylvania over the love of his wealthy backer Mrs. Teasdale, contending with two inept spies who can't seem to keep straight which side they're on.",Leo McCarey,,,,,,,
Frankenstein,1931,8,70,"Drama, Horror, Sci-Fi",7.8,Dr. Frankenstein dares to tamper with life and death by creating a human monster out of lifeless body parts.,James Whale,,,,,,,
Roma,2018,15,135,Drama,7.7,A year in the life of a middle-class family's maid in Mexico City in the early 1970s.,Alfonso Cuarón,,,,,,,
Deadpool 2,2018,15,119,"Action, Adventure, Comedy",7.7,"Foul-mouthed mutant mercenary Wade Wilson (a.k.a. Deadpool) assembles a team of fellow mutant rogues to protect a young boy with supernatural abilities from the brutal, time-traveling cyborg Cable.",David Leitch,,,,,,,
Sound of Metal,2019,15,120,"Drama, Music",7.7,A heavy-metal drummer's life is thrown into freefall when he begins to lose his hearing.,Darius Marder,,,,,,,
Wind River,2017,15,107,"Crime, Drama, Mystery",7.7,A veteran hunter helps an FBI agent investigate the murder of a young woman on a Wyoming Native American reservation.,Taylor Sheridan,,,,,,,
The Salesman,2016,12,124,Drama,7.7,"While Ranaa and Emad, a married couple, are participating in a production of ""Death of a Salesman,"" she is assaulted in their new home, which leaves him determined to find the perpetrator over his wife's traumatized objections.",Asghar Farhadi,,,,,,,
Get Out,2017,15,104,"Horror, Mystery, Thriller",7.7,"A young African-American visits his white girlfriend's parents for the weekend, where his simmering uneasiness about their reception of him eventually reaches a boiling point.",Jordan Peele,,,,,,,
Mission: Impossible - Fallout,2018,12,147,"Action, Adventure, Thriller",7.7,"Ethan Hunt and his IMF team, along with some familiar allies, race against time after a mission gone wrong.",Christopher McQuarrie,,,,,,,
Udta Punjab,2016,15,148,"Action, Crime, Drama",7.7,A story that revolves around drug abuse in the affluent north Indian State of Punjab and how the youth there have succumbed to it en-masse resulting in a socio-economic decline.,Abhishek Chaubey,,,,,,,
Kubo and the Two Strings,2016,8,101,"Animation, Action, Adventure",7.7,A young boy named Kubo must locate a magical suit of armour worn by his late father in order to defeat a vengeful spirit from the past.,Travis Knight,,,,,,,
A Man Called Ove,2015,15,116,"Comedy, Drama, Romance",7.7,"Ove, an ill-tempered, isolated retiree who spends his days enforcing block association rules and visiting his wife's grave, has finally given up on life just as an unlikely friendship develops with his boisterous new neighbors.",Hannes Holm,,,,,,,
When Marnie Was There,2014,4,103,"Animation, Drama, Family",7.7,"Due to 12 y.o. Anna's asthma, she's sent to stay with relatives of her guardian in the Japanese countryside. She likes to be alone, sketching. She befriends Marnie. Who is the mysterious, blonde Marnie.",Hiromasa Yonebayashi,,,,,,,
The Theory of Everything,2014,12,123,"Biography, Drama, Romance",7.7,A look at the relationship between the famous physicist  and his wife.,James Marsh,,,,,,,
Kingsman: The Secret Service,2014,15,129,"Action, Adventure, Comedy",7.7,"A spy organisation recruits a promising street kid into the agency's training program, while a global threat emerges from a twisted tech genius.",Matthew Vaughn,,,,,,,
The Fault in Our Stars,2014,12,126,"Drama, Romance",7.7,Two teenage cancer patients begin a life-affirming journey to visit a reclusive author in Amsterdam.,Josh Boone,,,,,,,
Me and Earl and the Dying Girl,2015,12,105,"Comedy, Drama",7.7,"High schooler Greg, who spends most of his time making parodies of classic movies with his co-worker Earl, finds his outlook forever altered after befriending a classmate who has just been diagnosed with cancer.",Alfonso Gomez-Rejon,,,,,,,
Birdman or (The Unexpected Virtue of Ignorance),2014,15,119,"Comedy, Drama",7.7,"A washed-up superhero actor attempts to revive his fading career by writing, directing, and starring in a Broadway production.",Alejandro G. Iñárritu,,,,,,,
The Past,2013,12,130,"Drama, Mystery",7.7,"An Iranian man deserts his French wife and her two children to return to his homeland. Meanwhile, his wife starts up a new relationship, a reality her husband confronts upon his wife's request for a divorce.",Asghar Farhadi,,,,,,,
The Great Beauty,2013,15,141,Drama,7.7,"Jep Gambardella has seduced his way through the lavish nightlife of Rome for decades, but after his 65th birthday and a shock from the past, Jep looks past the nightclubs and parties to find a timeless landscape of absurd, exquisite beauty.",Paolo Sorrentino,,,,,,,
Blue Is the Warmest Colour,2013,18,180,"Drama, Romance",7.7,"Adèle's life is changed when she meets Emma, a young woman with blue hair, who will allow her to discover desire and to assert herself as a woman and as an adult. In front of others, Adèle grows, seeks herself, loses herself, and ultimately finds herself through love and loss.",Abdellatif Kechiche,,,,,,,
The Broken Circle Breakdown,2012,15,111,"Drama, Music, Romance",7.7,"Elise and Didier fall in love at first sight, in spite of their differences. He talks, she listens. He's a romantic atheist, she's a religious realist. When their daughter becomes seriously ill, their love is put on trial.",Felix van Groeningen,,,,,,,
The Wind Rises,2013,8,126,"Animation, Biography, Drama",7.7,"A look at the life of Jiro Horikoshi, the man who designed Japanese fighter planes during World War II.",Hayao Miyazaki,,,,,,,
Toy Story 4,2019,4,100,"Animation, Adventure, Comedy",7.7,"When a new toy called ""Forky"" joins Woody and the gang, a road trip alongside old and new friends reveals how big the world can be for a toy.",Josh Cooley,,,,,,,
Nebraska,2013,15,115,"Adventure, Comedy, Drama",7.7,"An aging, booze-addled father makes the trip from Montana to Nebraska with his estranged son in order to claim a million-dollar Mega Sweepstakes Marketing prize.",Alexander Payne,,,,,,,
Wreck-It Ralph,2012,8,101,"Animation, Adventure, Comedy",7.7,"A video game villain wants to be a hero and sets out to fulfill his dream, but his quest brings havoc to the whole arcade where he lives.",Rich Moore,,,,,,,
The Little Prince,2015,8,108,"Animation, Adventure, Drama",7.7,"A little girl lives in a very grown-up world with her mother, who tries to prepare her for it. Her neighbor, the Aviator, introduces the girl to an extraordinary world where anything is possible, the world of the Little Prince.",Mark Osborne,,,,,,,
Detachment,2011,15,98,Drama,7.7,A substitute teacher who drifts from classroom to classroom finds a connection to the students and teachers during his latest assignment.,Tony Kaye,,,,,,,
Midnight in Paris,2011,12,94,"Comedy, Fantasy, Romance",7.7,"While on a trip to Paris with his fiancée's family, a nostalgic screenwriter finds himself mysteriously going back to the 1920s every day at midnight.",Woody Allen,,,,,,,
Confessions,2010,15,106,"Drama, Thriller",7.7,A psychological thriller of a grieving mother turned cold-blooded avenger with a twisty master plan to pay back those who were responsible for her daughter's death.,Tetsuya Nakashima,,,,,,,
The Man from Nowhere,2010,18,119,"Action, Crime, Drama",7.7,A quiet pawnshop keeper with a violent past takes on a drug-and-organ trafficking ring in hope of saving the child who is his only friend.,Jeong-beom Lee,,,,,,,
The Lego Movie,2014,4,100,"Animation, Action, Adventure",7.7,"An ordinary LEGO construction worker, thought to be the prophesied as ""special"", is recruited to join a quest to stop an evil tyrant from gluing the LEGO universe into eternal stasis.",Phil Lord,,,,,,,
Gravity,2013,12,91,"Action, Drama, Sci-Fi",7.7,Two astronauts work together to survive after an accident leaves them stranded in space.,Alfonso Cuarón,,,,,,,
Star Trek Into Darkness,2013,12,132,"Action, Adventure, Sci-Fi",7.7,"After the crew of the Enterprise find an unstoppable force of terror from within their own organization, Captain Kirk leads a manhunt to a war-zone world to capture a one-man weapon of mass destruction.",J.J. Abrams,,,,,,,
Beasts of No Nation,2015,15,137,"Drama, War",7.7,"A drama based on the experiences of Agu, a child soldier fighting in the civil war of an unnamed African country.",Cary Joji Fukunaga,,,,,,,
X-Men: First Class,2011,12,131,"Action, Adventure, Sci-Fi",7.7,"In the 1960s, superpowered humans Charles Xavier and Erik Lensherr work together to find others like them, but Erik's vengeful pursuit of an ambitious mutant who ruined his life causes a schism to divide them.",Matthew Vaughn,,,,,,,
The Hangover,2009,15,100,Comedy,7.7,"Three buddies wake up from a bachelor party in Las Vegas, with no memory of the previous night and the bachelor missing. They make their way around the city in order to find their friend before his wedding.",Todd Phillips,,,,,,,
The Trial of the Chicago 7,2020,15,129,"Drama, History, Thriller",7.7,"The story of 7 people on trial stemming from various charges surrounding the uprising at the 1968 Democratic National Convention in Chicago, Illinois.",Aaron Sorkin,,,,,,,
Silver Linings Playbook,2012,15,122,"Comedy, Drama, Romance",7.7,"After a stint in a mental institution, former teacher Pat Solitano moves back in with his parents and tries to reconcile with his ex-wife. Things get more challenging when Pat meets Tiffany, a mysterious girl with problems of her own.",David O. Russell,,,,,,,
Another Round,2020,12,117,"Comedy, Drama",7.7,Four high-school teachers consume alcohol on a daily basis to see how it affects their social and professional lives.,Thomas Vinterberg,,,,,,,
Argo,2012,15,120,"Biography, Drama, Thriller",7.7,"Acting under the cover of a Hollywood producer scouting a location for a science fiction film, a CIA agent launches a dangerous operation to rescue six Americans in Tehran during the U.S. hostage crisis in Iran in 1979.",Ben Affleck,,,,,,,
500 Days of Summer,2009,12,95,"Comedy, Drama, Romance",7.7,"After being dumped by the girl he believes to be his soulmate, hopeless romantic Tom Hansen reflects on their relationship to try and figure out where things went wrong and how he can win her back.",Marc Webb,,,,,,,
Harry Potter and the Deathly Hallows: Part 1,2010,12,146,"Adventure, Family, Fantasy",7.7,"As Harry, Ron, and Hermione race against time and evil to destroy the Horcruxes, they uncover the existence of the three most powerful objects in the wizarding world: the Deathly Hallows.",David Yates,,,,,,,
The Boy in the Striped Pyjamas,2008,12,94,"Drama, War",7.7,"Through the innocent eyes of Bruno, the eight-year-old son of the commandant at a German concentration camp, a forbidden friendship with a Jewish boy on the other side of the camp fence has startling and unexpected consequences.",Mark Herman,,,,,,,
The Edge of Heaven,2007,18,122,Drama,7.7,A Turkish man travels to Istanbul to find the daughter of his father's former girlfriend.,Fatih Akin,,,,,,,
Frost/Nixon,2008,15,122,"Biography, Drama, History",7.7,A dramatic retelling of the post-Watergate television interviews between British talk-show host  and former president .,Ron Howard,,,,,,,
Paprika,2006,15,90,"Animation, Drama, Fantasy",7.7,"When a machine that allows therapists to enter their patients' dreams is stolen, all hell breaks loose. Only a young female therapist, Paprika, can stop it.",Satoshi Kon,,,,,,,
Flipped,2010,8,90,"Comedy, Drama, Romance",7.7,Two eighth-graders start to have feelings for each other despite being total opposites.,Rob Reiner,,,,,,,
The Girl Who Leapt Through Time,2006,12,98,"Animation, Adventure, Comedy",7.7,"A high-school girl named Makoto acquires the power to travel back in time, and decides to use it for her own personal benefits. Little does she know that she is affecting the lives of others just as much as she is her own.",Mamoru Hosoda,,,,,,,
This Is England,2006,18,101,"Crime, Drama",7.7,"A young boy becomes friends with a gang of skinheads. Friends soon become like family, and relationships will be pushed to the very limit.",Shane Meadows,,,,,,,
Ex Machina,2014,15,108,"Drama, Sci-Fi, Thriller",7.7,A young programmer is selected to participate in a ground-breaking experiment in synthetic intelligence by evaluating the human qualities of a highly advanced humanoid A.I.,Alex Garland,,,,,,,
After the Wedding,2006,15,120,Drama,7.7,"A manager of an orphanage in India is sent to Copenhagen, Denmark, where he discovers a life-altering family secret.",Susanne Bier,,,,,,,
The Last King of Scotland,2006,15,123,"Biography, Drama, History",7.7,Based on the events of the brutal Ugandan dictator 's regime as seen by his personal physician during the 1970s.,Kevin Macdonald,,,,,,,
Zodiac,2007,15,157,"Crime, Drama, Mystery",7.7,"Between 1968 and 1983, a San Francisco cartoonist becomes an amateur detective obsessed with tracking down the Zodiac Killer, an unidentified individual who terrorizes Northern California with a killing spree.",David Fincher,,,,,,,
Lucky Number Slevin,2006,18,110,"Crime, Drama, Thriller",7.7,"A case of mistaken identity lands Slevin into the middle of a war being plotted by two of the city's most rival crime bosses. Under constant surveillance by Detective Brikowski and assassin Goodkat, he must get them before they get him.",Paul McGuigan,,,,,,,
Joyeux Noel,2005,12,116,"Drama, History, Music",7.7,"In December 1914, an unofficial Christmas truce on the Western Front allows soldiers from opposing sides of the First World War to gain insight into each other's way of life.",Christian Carion,,,,,,,
Control,2007,15,122,"Biography, Drama, Music",7.7,"A profile of , the enigmatic singer of  whose personal, professional, and romantic troubles led him to commit suicide at the age of 23.",Anton Corbijn,,,,,,,
Adam's Apples,2005,17,94,"Comedy, Crime, Drama",7.7,A neo-Nazi sentenced to community service at a church clashes with the blindly devoted minister.,Anders Thomas Jensen,,,,,,,
Tangled,2010,8,100,"Animation, Adventure, Comedy",7.7,"The magically long-haired Rapunzel has spent her entire life in a tower, but now that a runaway thief has stumbled upon her, she is about to discover the world for the first time, and who she really is.",Nathan Greno,,,,,,,
Black Book,2006,15,145,"Drama, Thriller, War",7.7,"In the Nazi-occupied Netherlands during World War II, a Jewish singer infiltrates the regional Gestapo headquarters for the Dutch resistance.",Paul Verhoeven,,,,,,,
