Gone Girl,2014,18,149,"Drama, Mystery, Thriller",8.1,"With his wife's disappearance having become the focus of an intense media circus, a man sees the spotlight turned on him when it's suspected that he may not be innocent.",David Fincher,,,,,,,
Wolf Children,2012,8,117,"Animation, Drama, Family",8.1,"After her werewolf lover unexpectedly dies in an accident while hunting for food for their children, a young woman must find ways to raise the werewolf son and daughter that she had with him while keeping their trait hidden from society.",Mamoru Hosoda,,,,,,,
Hacksaw Ridge,2016,15,139,"Biography, Drama, History",8.1,"World War II American Army Medic , who served during the Battle of Okinawa, refuses to kill people and becomes the first man in American history to receive the Medal of Honor without firing a shot.",Mel Gibson,,,,,,,
Barfi!,2012,8,151,"Comedy, Drama, Romance",8.1,Three young people learn that love can neither be defined nor contained by society's definition of normal and abnormal.,Anurag Basu,,,,,,,
12 Years a Slave,2013,15,134,"Biography, Drama, History",8.1,"In the antebellum United States, , a free black man from upstate New York, is abducted and sold into slavery.",Steve McQueen,,,,,,,
Rush,2013,15,123,"Action, Biography, Drama",8.1,The merciless 1970s rivalry between Formula One rivals  and .,Ron Howard,,,,,,,
Le Mans '66,2019,12,152,"Action, Biography, Drama",8.1,American car designer  and driver  battle corporate interference and the laws of physics to build a revolutionary race car for Ford in order to defeat Ferrari at the 24 Hours of Le Mans in 1966.,James Mangold,,,,,,,
Spotlight,2015,15,129,"Biography, Crime, Drama",8.1,"The true story of how the Boston Globe uncovered the massive scandal of child molestation and cover-up within the local Catholic Archdiocese, shaking the entire Catholic Church to its core.",Tom McCarthy,,,,,,,
Kahaani,2012,15,122,"Mystery, Thriller",8.1,"A pregnant woman's search for her missing husband takes her from London to Kolkata, but everyone she questions denies having ever met him.",Sujoy Ghosh,,,,,,,
Zindagi Na Milegi Dobara,2011,8,155,"Comedy, Drama, Musical",8.1,Three friends decide to turn their fantasy vacation into reality after one of their friends gets engaged.,Zoya Akhtar,,,,,,,
The Help,2011,12,146,Drama,8.1,"An aspiring author during the civil rights movement of the 1960s decides to write a book detailing the African American maids' point of view on the white families for which they work, and the hardships they go through on a daily basis.",Tate Taylor,,,,,,,
Prisoners,2013,15,153,"Crime, Drama, Mystery",8.1,"When Keller Dover's daughter and her friend go missing, he takes matters into his own hands as the police pursue multiple leads and the pressure mounts.",Denis Villeneuve,,,,,,,
Mad Max: Fury Road,2015,15,120,"Action, Adventure, Sci-Fi",8.1,"In a post-apocalyptic wasteland, a woman rebels against a tyrannical ruler in search for her homeland with the aid of a group of female prisoners, a psychotic worshiper, and a drifter named Max.",George Miller,,,,,,,
A Wednesday,2008,15,104,"Action, Crime, Drama",8.1,A retiring police officer reminisces about the most astounding day of his career. About a case that was never filed but continues to haunt him in his memories - the case of a man and a Wednesday.,Neeraj Pandey,,,,,,,
Gran Torino,2008,15,116,Drama,8.1,"Disgruntled Korean War veteran Walt Kowalski sets out to reform his neighbor, Thao Lor, a Hmong teenager who tried to steal Kowalski's prized possession: a 1972 Gran Torino.",Clint Eastwood,,,,,,,
Harry Potter and the Deathly Hallows: Part 2,2011,12,130,"Adventure, Fantasy, Horror",8.1,"Harry, Ron, and Hermione search for Voldemort's remaining Horcruxes in their effort to destroy the Dark Lord as the final battle rages on at Hogwarts.",David Yates,,,,,,,
Hachi: A Dog's Tale,2009,4,93,"Biography, Drama, Family",8.1,A college professor bonds with an abandoned dog he takes into his home.,Lasse Hallström,,,,,,,
Mary and Max,2009,12,92,"Animation, Comedy, Drama",8.1,"A tale of friendship between two unlikely pen pals: Mary, a lonely, eight-year-old girl living in the suburbs of Melbourne, and Max, a forty-four-year old, severely obese man living in New York.",Adam Elliot,,,,,,,
How to Train Your Dragon,2010,8,98,"Animation, Action, Adventure",8.1,"A hapless young Viking who aspires to hunt dragons becomes the unlikely friend of a young dragon himself, and learns there may be more to the creatures than he assumed.",Dean DeBlois,,,,,,,
Chakde! India,2007,8,153,"Drama, Family, Sport",8.1,"Kabir Khan, the coach of the Indian Women's National Hockey Team, dreams of making his all-girls team emerge victorious against all odds.",Shimit Amin,,,,,,,
Into the Wild,2007,15,148,"Adventure, Biography, Drama",8.1,"After graduating from Emory University, top student and athlete Christopher McCandless abandons his possessions, gives his entire $24,000 savings account to charity and hitchhikes to Alaska to live in the wilderness. Along the way, Christopher encounters a series of characters that shape his life.",Sean Penn,,,,,,,
Color It Yellow,2006,15,167,"Comedy, Crime, Drama",8.1,"The story of six young Indians who assist an English woman to film a documentary on the freedom fighters from their past, and the events that lead them to relive the long-forgotten saga of freedom.",Rakeysh Omprakash Mehra,,,,,,,
Million Dollar Baby,2004,12,132,"Drama, Sport",8.1,A determined woman works with a hardened boxing trainer to become a professional.,Clint Eastwood,,,,,,,
Hotel Rwanda,2004,12,121,"Biography, Drama, History",8.1,", a hotel manager, houses over a thousand Tutsi refugees during their struggle against the Hutu militia in Rwanda, Africa.",Terry George,,,,,,,
Ratatouille,2007,4,111,"Animation, Adventure, Comedy",8.1,A rat who can cook makes an unusual alliance with a young kitchen worker at a famous Paris restaurant.,Brad Bird,,,,,,,
Before Sunset,2004,15,80,"Drama, Romance",8.1,"Nine years after Jesse and Celine first met, they encounter each other again on the French leg of Jesse's book tour.",Richard Linklater,,,,,,,
Black,2005,12,122,Drama,8.1,"The cathartic tale of a young woman who can't see, hear, or speak, and the teacher who brings a ray of light into her dark world.",Sanjay Leela Bhansali,,,,,,,
Munna Bhai M.B.B.S.,2003,8,156,"Comedy, Drama",8.1,A gangster sets out to fulfill his father's dream of becoming a doctor.,Rajkumar Hirani,,,,,,,
"Swades: We, the People",2004,4,210,"Drama, Musical",8.1,A successful Indian scientist returns to an Indian village to take his nanny to America with him and in the process rediscovers his roots.,Ashutosh Gowariker,,,,,,,
Memories of Murder,2003,15,131,"Crime, Drama, Mystery",8.1,"In a small Korean province in 1986, two detectives struggle with the case of multiple young women being found raped and murdered by an unknown culprit.",Bong Joon Ho,,,,,,,
Pirates of the Caribbean: The Curse of the Black Pearl,2003,12,143,"Action, Adventure, Fantasy",8.1,"Blacksmith Will Turner teams up with eccentric pirate ""Captain"" Jack Sparrow to save his love, the governor's daughter, from Jack's former pirate allies, who are now undead.",Gore Verbinski,,,,,,,
Dil Chahta Hai,2001,8,183,"Comedy, Drama, Romance",8.1,"Three inseparable childhood friends are just out of college. Nothing comes between them - until they each fall in love, and their wildly different approaches to relationships creates tension.",Farhan Akhtar,,,,,,,
Catch Me If You Can,2002,12,141,"Biography, Crime, Drama",8.1,"Barely 21 yet, Frank is a skilled forger who has passed as a doctor, lawyer and pilot. FBI agent Carl becomes obsessed with tracking down the con man, who only revels in the pursuit.",Steven Spielberg,,,,,,,
Everything's Gonna Be Great,1998,,107,"Comedy, Drama, Thriller",8.1,"When Altan swipes prescription drugs from his brother Nuri's pharmacy, they soon find themselves on a dangerous but funny road trip to get rid of the stuff and escape the mafiosi Altan ...                 »",Ömer Vargi,,,,,,,
Amores perros,2000,18,154,"Drama, Thriller",8.1,"A horrific car accident connects three stories, each involving characters dealing with loss, regret, and life's harsh realities, all in the name of love.",Alejandro G. Iñárritu,,,,,,,
Hera Pheri,2000,15,156,"Action, Comedy, Crime",8.1,"Three unemployed men look for answers to all their money problems - but when their opportunity arrives, will they know what to do with it?",Priyadarshan,,,,,,,
Sarfarosh,1999,18,174,"Action, Drama, Thriller",8.1,"After his brother is killed and father severely injured by terrorists, a young med student quits his studies to join the Indian Police Service to wipe out the terrorists.",John Mathew Matthan,,,,,,,
"Monsters, Inc.",2001,4,92,"Animation, Adventure, Comedy",8.1,"In order to power the city, monsters have to scare children so that they scream. However, the children are toxic to the monsters, and after a child gets through, two monsters realize things may not be what they think.",Pete Docter,,,,,,,
Lagaan: Once Upon a Time in India,2001,8,224,"Drama, Musical, Sport",8.1,The people of a small village in Victorian India stake their future on a game of cricket against their ruthless British rulers.,Ashutosh Gowariker,,,,,,,
The Celebration,1998,15,105,Drama,8.1,"At Helge's 60th birthday party, some unpleasant family truths are revealed.",Thomas Vinterberg,,,,,,,
The Iron Giant,1999,4,86,"Animation, Action, Adventure",8.1,A young boy befriends a giant robot from outer space that a paranoid government agent wants to destroy.,Brad Bird,,,,,,,
The Big Lebowski,1998,18,117,"Comedy, Crime",8.1,"Ultimate L.A. slacker Jeff ""The Dude"" Lebowski, mistaken for a millionaire of the same name, seeks restitution for a rug ruined by debt collectors, enlisting his bowling buddies for help while trying to find the millionaire's missing wife.",Joel Coen,,,,,,,
Trainspotting,1996,18,93,Drama,8.1,"Renton, deeply immersed in the Edinburgh drug scene, tries to clean up and get out, despite the allure of the drugs and influence of friends.",Danny Boyle,,,,,,,
Fargo,1996,18,98,"Crime, Thriller",8.1,Minnesota car salesman Jerry Lundegaard's inept crime falls apart due to his and his henchmen's bungling and the persistent police work of the quite pregnant Marge Gunderson.,Joel Coen,,,,,,,
The Bandit,1996,15,128,"Crime, Drama, Thriller",8.1,"Baran the Bandit, released from prison after 35 years, searches for vengeance and his lover.",Yavuz Turgul,,,,,,,
Underground,1995,15,170,"Comedy, Drama, Fantasy",8.1,"A group of Serbian socialists prepares for the war in a surreal underground filled by parties, tragedies, love, and hate.",Emir Kusturica,,,,,,,
La Haine,1995,15,98,"Crime, Drama",8.1,24 hours in the lives of three young men in the French suburbs the day after a violent riot.,Mathieu Kassovitz,,,,,,,
Before Sunrise,1995,15,101,"Drama, Romance",8.1,"A young man and woman meet on a train in Europe, and wind up spending one evening together in Vienna. Unfortunately, both know that this will probably be their only night together.",Richard Linklater,,,,,,,
Three Colours: Red,1994,15,99,"Drama, Mystery, Romance",8.1,A model discovers a retired judge is keen on invading people's privacy.,Krzysztof Kieslowski,,,,,,,
In the Name of the Father,1993,15,133,"Biography, Crime, Drama",8.1,A man's coerced confession to an I.R.A. bombing he did not commit results in the imprisonment of his father as well. An English lawyer fights to free them.,Jim Sheridan,,,,,,,
Groundhog Day,1993,8,101,"Comedy, Drama, Fantasy",8.1,A self-centered Pittsburgh weatherman finds himself inexplicably trapped in a small town as he lives the same day over and over again.,Harold Ramis,,,,,,,
Farewell My Concubine,1993,15,171,"Drama, Music, Romance",8.1,Two boys meet at an opera training school in Peking in 1924. Their resulting friendship will span nearly 70 years and will endure some of the most troublesome times in China's history.,Kaige Chen,,,,,,,
Raise the Red Lantern,1991,8,125,"Drama, History, Romance",8.1,"A young woman becomes the fourth wife of a wealthy lord, and must learn to live with the strict rules and tensions within the household.",Yimou Zhang,,,,,,,
Time of the Gypsies,1988,15,142,"Comedy, Crime, Drama",8.1,"In this luminous tale set in the area around Sarajevo and in Italy, Perhan, an engaging young Romany (gypsy) with telekinetic powers, is seduced by the quick-cash world of petty crime, which threatens to destroy him and those he loves.",Emir Kusturica,,,,,,,
Dead Poets Society,1989,8,128,"Comedy, Drama",8.1,Maverick teacher John Keating uses poetry to embolden his boarding school students to new heights of self-expression.,Peter Weir,,,,,,,
My Neighbour Totoro,1988,4,86,"Animation, Comedy, Family",8.1,"When two girls move to the country to be near their ailing mother, they have adventures with the wondrous forest spirits who live nearby.",Hayao Miyazaki,,,,,,,
Stand by Me,1986,15,89,"Adventure, Drama",8.1,"After the death of one of his friends, a writer recounts a childhood journey with his friends to find the body of a missing boy.",Rob Reiner,,,,,,,
Platoon,1986,15,120,"Drama, War",8.1,"Chris Taylor, a neophyte recruit in Vietnam, finds himself caught in a battle of wills between two sergeants, one good and the other evil. A shrewd examination of the brutality of war and the duality of man in conflict.",Oliver Stone,,,,,,,
Jean de Florette,1986,8,120,"Comedy, Drama, Western",8.1,A greedy landowner and his backward nephew conspire to block the only water source for an adjoining property in order to bankrupt the owner and force him to sell.,Claude Berri,,,,,,,
The Terminator,1984,18,107,"Action, Sci-Fi",8.1,"A human soldier is sent from 2029 to 1984 to stop an almost indestructible cyborg killing machine, sent from the same year, which has been programmed to execute a young woman whose unborn son is the key to humanity's future salvation.",James Cameron,,,,,,,
Gandhi,1982,12,191,"Biography, Drama",8.1,The life of the lawyer who became the famed leader of the Indian revolts against the British rule through his philosophy of nonviolent protest.,Richard Attenborough,,,,,,,
Fanny and Alexander,1982,15,188,Drama,8.1,"Two young Swedish children in the 1900s experience the many comedies and tragedies of their lively and affectionate theatrical family, the Ekdahls.",Ingmar Bergman,,,,,,,
Blade Runner,1982,14,117,"Action, Drama, Sci-Fi",8.1,"A blade runner must pursue and terminate four replicants who stole a ship in space, and have returned to Earth to find their creator.",Ridley Scott,,,,,,,
Stalker,1979,8,162,"Drama, Sci-Fi",8.1,A guide leads two men through an area known as the Zone to find a room that grants wishes.,Andrei Tarkovsky,,,,,,,
Autumn Sonata,1978,14,92,"Drama, Music",8.1,"A devoted wife is visited by her mother, a successful concert pianist who had little time for her when she was young.",Ingmar Bergman,,,,,,,
The Deer Hunter,1978,14,183,"Drama, War",8.1,An in-depth examination of the ways in which the Vietnam War impacts and disrupts the lives of several friends in a small steel mill town in Pennsylvania.,Michael Cimino,,,,,,,
Rocky,1976,12,120,"Drama, Sport",8.1,A small-time Philadelphia boxer gets a supremely rare chance to fight the world heavyweight champion in a bout in which he strives to go the distance for his self-respect.,John G. Avildsen,,,,,,,
Network,1976,14,121,Drama,8.1,"A television network cynically exploits a deranged former anchor's ravings and revelations about the news media for its own profit, but finds that his message may be difficult to control.",Sidney Lumet,,,,,,,
The Message,1976,8,177,"Biography, Drama, History",8.1,This epic historical drama chronicles the life and times of Prophet Muhammad and serves as an introduction to early Islamic history.,Moustapha Akkad,,,,,,,
Sholay,1975,8,204,"Action, Adventure, Comedy",8.1,"After his family is murdered by a notorious and ruthless bandit, a former police officer enlists the services of two outlaws to capture the bandit.",Ramesh Sippy,,,,,,,
Jaws,1975,12,124,"Adventure, Thriller",8.1,"When a killer shark unleashes chaos on a beach community off Long Island, it's up to a local sheriff, a marine biologist, and an old seafarer to hunt the beast down.",Steven Spielberg,,,,,,,
Barry Lyndon,1975,12,185,"Adventure, Drama, War",8.1,An Irish rogue wins the heart of a rich widow and assumes her dead husband's aristocratic position in 18th-century England.,Stanley Kubrick,,,,,,,
Paper Moon,1973,12,102,"Comedy, Crime, Drama",8.1,"During the Great Depression, a con man finds himself saddled with a young girl who may or may not be his daughter, and the two forge an unlikely partnership.",Peter Bogdanovich,,,,,,,
The Exorcist,1973,14,122,Horror,8.1,"When a 12-year-old girl is possessed by a mysterious entity, her mother seeks the help of two priests to save her.",William Friedkin,,,,,,,
Anand,1971,4,122,"Drama, Musical",8.1,"The story of a terminally ill man who wishes to live life to the fullest before the inevitable occurs, as told by his best friend.",Hrishikesh Mukherjee,,,,,,,
Cool Hand Luke,1967,12,127,"Crime, Drama",8.1,"A laid back Southern man is sentenced to two years in a rural prison, but refuses to conform.",Stuart Rosenberg,,,,,,,
Persona,1966,14,85,"Drama, Thriller",8.1,A nurse is put in charge of a mute actress and finds that their personae are melding together.,Ingmar Bergman,,,,,,,
The Sound of Music,1965,4,172,"Biography, Drama, Family",8.1,A young novitiate is sent by her convent in 1930s Austria to become a governess to the seven children of a widowed naval officer.,Robert Wise,,,,,,,
The Battle of Algiers,1966,14,121,"Drama, War",8.1,"In the 1950s, fear and violence escalate as the people of Algiers fight for independence from the French government.",Gillo Pontecorvo,,,,,,,
The Man Who Shot Liberty Valance,1962,4,123,"Drama, Western",8.1,A senator returns to a western town for the funeral of an old friend and tells the story of his origins.,John Ford,,,,,,,
The Virgin Spring,1960,15,89,Drama,8.1,"In 14th-century Sweden, an innocent yet pampered teenage girl and her family's pregnant and jealous servant set out from their farm to deliver candles to church, but only one returns from events that transpire in the woods along the way.",Ingmar Bergman,,,,,,,
Inherit the Wind,1960,12,128,"Biography, Drama, History",8.1,"Based on a real-life case in 1925, two great lawyers argue the case for and against a Tennessee science teacher accused of the crime of teaching evolution.",Stanley Kramer,,,,,,,
The 400 Blows,1959,12,99,"Crime, Drama",8.1,"A young boy, left without attention, delves into a life of petty crime.",François Truffaut,,,,,,,
Ben-Hur,1959,12,212,"Adventure, Drama, History",8.1,"After a Jewish prince is betrayed and sent into slavery by a Roman friend in 1st-century Jerusalem, he regains his freedom and comes back for revenge.",William Wyler,,,,,,,
The Hidden Fortress,1958,12,139,"Action, Adventure, Drama",8.1,"Lured by gold, two greedy peasants unknowingly escort a princess and her general across enemy lines.",Akira Kurosawa,,,,,,,
Wild Strawberries,1957,12,91,"Drama, Romance",8.1,"After living a life marked by coldness, an aging professor is forced to confront the emptiness of his existence.",Ingmar Bergman,,,,,,,
The Seventh Seal,1957,14,96,"Drama, Fantasy",8.1,"A knight returning to Sweden after the Crusades seeks answers about life, death, and the existence of God as he plays chess against the Grim Reaper during the Black Plague.",Ingmar Bergman,,,,,,,
Nights of Cabiria,1957,14,110,Drama,8.1,A waifish prostitute wanders the streets of Rome looking for true love but finds only heartbreak.,Federico Fellini,,,,,,,
Throne of Blood,1957,12,110,"Drama, History",8.1,"A war-hardened general, egged on by his ambitious wife, works to fulfill a prophecy that he would become lord of Spider's Web Castle.",Akira Kurosawa,,,,,,,
Rififi,1955,12,118,"Crime, Drama, Thriller",8.1,"Four men plan a technically perfect crime, but the human element intervenes...",Jules Dassin,,,,,,,
On the Waterfront,1954,12,108,"Crime, Drama, Thriller",8.1,"An ex-prize fighter turned New Jersey longshoreman struggles to stand up to his corrupt union bosses, including his older brother, as he starts to connect with the grieving sister of one of the syndicate's victims.",Elia Kazan,,,,,,,
Les Diaboliques,1955,14,117,"Crime, Drama, Horror",8.1,The wife and mistress of a loathed school principal plan to murder him with what they believe is the perfect alibi.,Henri-Georges Clouzot,,,,,,,
Ace in the Hole,1951,12,111,"Drama, Film-Noir",8.1,"A frustrated former big-city journalist now stuck working for an Albuquerque newspaper exploits a story about a man trapped in a cave to rekindle his career, but the situation quickly escalates into an out-of-control circus.",Billy Wilder,,,,,,,
White Heat,1949,12,114,"Action, Crime, Drama",8.1,A psychopathic criminal with a mother complex makes a daring break from prison and leads his old gang in a chemical plant payroll heist.,Raoul Walsh,,,,,,,
The Third Man,1949,12,104,"Film-Noir, Mystery, Thriller",8.1,"Pulp novelist Holly Martins travels to shadowy, postwar Vienna, only to find himself investigating the mysterious death of an old friend, Harry Lime.",Carol Reed,,,,,,,
The Red Shoes,1948,4,135,"Drama, Music, Romance",8.1,A young ballet dancer is torn between the man she loves and her pursuit to become a prima ballerina.,Michael Powell,,,,,,,
The Best Years of Our Lives,1946,4,170,"Drama, Romance, War",8.1,"Three World War II veterans, two of them traumatized or disabled, return home to the American midwest to discover that they and their families have been irreparably changed.",William Wyler,,,,,,,
The Shop Around the Corner,1940,4,99,"Comedy, Drama, Romance",8.1,"Two employees at a gift shop can barely stand each other, without realizing that they are falling in love through the post as each other's anonymous pen pal.",Ernst Lubitsch,,,,,,,
Rebecca,1940,12,130,"Drama, Film-Noir, Mystery",8.1,A self-conscious woman juggles adjusting to her new role as an aristocrat's wife and avoiding being intimidated by his first wife's spectral presence.,Alfred Hitchcock,,,,,,,
The Grapes of Wrath,1940,12,129,Drama,8.1,"An Oklahoma family, driven off their farm by the poverty and hopelessness of the Dust Bowl, joins the westward migration to California, suffering the misfortunes of the homeless in the Great Depression.",John Ford,,,,,,,
The Wizard of Oz,1939,12,102,"Adventure, Family, Fantasy",8.1,"Young Dorothy Gale and her dog are swept away by a tornado from their Kansas farm to the magical Land of Oz, and embark on a quest with three new friends to see the Wizard, who can return her to her home and fulfill the others' wishes.",Victor Fleming,,,,,,,
Mr. Smith Goes to Washington,1939,4,129,"Comedy, Drama",8.1,"A naive youth leader is appointed to fill a vacancy in the U.S. Senate. His idealistic plans promptly collide with corruption at home and subterfuge from his hero in Washington, but he tries to forge ahead despite attacks on his character.",Frank Capra,,,,,,,
La Grande Illusion,1937,4,113,"Drama, War",8.1,"During WWI, two French soldiers are captured and imprisoned in a German P.O.W. camp. Several escape attempts follow until they are eventually sent to a seemingly inescapable fortress.",Jean Renoir,,,,,,,
It Happened One Night,1934,12,105,"Comedy, Romance",8.1,"A renegade reporter trailing a young runaway heiress for a big story joins her on a bus heading from Florida to New York, and they end up stuck with each other when the bus leaves them behind at one of the stops.",Frank Capra,,,,,,,
All Quiet on the Western Front,1930,8,152,"Drama, War",8.1,"A German youth eagerly enters World War I, but his enthusiasm wanes as he gets a firsthand view of the horror.",Lewis Milestone,,,,,,,
The Circus,1928,4,72,"Comedy, Family, Romance",8.1,The Tramp finds work and the girl of his dreams at a circus.,Charles Chaplin,,,,,,,
Sunrise: A Song of Two Humans,1927,12,94,"Drama, Romance",8.1,"A sophisticated urban woman seduces a farmer in the hopes that he will murder his neglected wife and join her in the city, but he soon finds himself rekindling his romance with the latter when she discovers their scheme.",F.W. Murnau,,,,,,,
Badhaai Ho,2018,12,124,"Comedy, Drama",8,A man is embarrassed when he finds out his mother is pregnant.,Amit Ravindernath Sharma,,,,,,,
Wolfwalkers,2020,8,103,"Animation, Adventure, Family",8,A young apprentice hunter and her father journey to Ireland to help wipe out the last wolf pack. But everything changes when she befriends a free-spirited girl from a mysterious tribe rumored to transform into wolves by night.,Tomm Moore,,,,,,,
The Invisible Guest,2016,15,106,"Crime, Drama, Mystery",8,A successful entrepreneur accused of murder and a witness preparation expert have less than three hours to come up with an impregnable defense.,Oriol Paulo,,,,,,,
La La Land,2016,12,128,"Comedy, Drama, Music",8,"While navigating their careers in Los Angeles, a pianist and an actress fall in love while attempting to reconcile their aspirations for the future.",Damien Chazelle,,,,,,,
Lion,2016,8,118,"Biography, Drama",8,"A five-year-old Indian boy is adopted by an Australian couple after getting lost hundreds of kilometers from home. 25 years later, he sets out to find his lost family.",Garth Davis,,,,,,,
The Martian,2015,12,144,"Adventure, Drama, Sci-Fi",8,"An astronaut becomes stranded on Mars after his team assume him dead, and must rely on his ingenuity to find a way to signal to Earth that he is alive and can survive until a potential rescue.",Ridley Scott,,,,,,,
Mommy,2014,15,139,Drama,8,"A widowed single mother, raising her violent son alone, finds new hope when a mysterious neighbor inserts herself into their household.",Xavier Dolan,,,,,,,
