https://www.kaggle.com/datasets/ramjasmaurya/top-250s-in-imdb,,,,,,,,,,,,,,
movie name,year,certificate,runtime,genre,imdb rating,sinopsys,director,,,,,,,
The Shawshank Redemption,1994,15,142,Drama,9.3,"Two imprisoned men bond over a number of years, finding solace and eventual redemption through acts of common decency.",Frank Darabont,,,,,,,
The Godfather,1972,14,175,"Crime, Drama",9.2,The aging patriarch of an organized crime dynasty in postwar New York City transfers control of his clandestine empire to his reluctant youngest son.,Francis Ford Coppola,,,,,,,
The Dark Knight,2008,12,152,"Action, Crime, Drama",9,"When the menace known as the Joker wreaks havoc and chaos on the people of Gotham, Batman must accept one of the greatest psychological and physical tests of his ability to fight injustice.",Christopher Nolan,,,,,,,
The Lord of the Rings: The Return of the King,2003,12,201,"Action, Adventure, Drama",9,Gandalf and Aragorn lead the World of Men against Sauron's army to draw his gaze from Frodo and Sam as they approach Mount Doom with the One Ring.,Peter Jackson,,,,,,,
Schindler's List,1993,15,195,"Biography, Drama, History",9,"In German-occupied Poland during World War II, industrialist  gradually becomes concerned for his Jewish workforce after witnessing their persecution by the Nazis.",Steven Spielberg,,,,,,,
The Godfather Part II,1974,14,202,"Crime, Drama",9,"The early life and career of Vito Corleone in 1920s New York City is portrayed, while his son, Michael, expands and tightens his grip on the family crime syndicate.",Francis Ford Coppola,,,,,,,
12 Angry Men,1957,4,96,"Crime, Drama",9,The jury in a New York City murder trial is frustrated by a single member whose skeptical caution forces them to more carefully consider the evidence before jumping to a hasty verdict.,Sidney Lumet,,,,,,,
Jai Bhim,2021,0,164,"Crime, Drama, Mystery",8.9,"When a tribal man is arrested for a case of alleged theft, his wife turns to a human-rights lawyer to help bring justice.",T.J. Gnanavel,,,,,,,
Pulp Fiction,1994,18,154,"Crime, Drama",8.9,"The lives of two mob hitmen, a boxer, a gangster and his wife, and a pair of diner bandits intertwine in four tales of violence and redemption.",Quentin Tarantino,,,,,,,
Inception,2010,12,148,"Action, Adventure, Sci-Fi",8.8,"A thief who steals corporate secrets through the use of dream-sharing technology is given the inverse task of planting an idea into the mind of a C.E.O., but his tragic past may doom the project and his team to disaster.",Christopher Nolan,,,,,,,
The Lord of the Rings: The Two Towers,2002,12,179,"Action, Adventure, Drama",8.8,"While Frodo and Sam edge closer to Mordor with the help of the shifty Gollum, the divided fellowship makes a stand against Sauron's new ally, Saruman, and his hordes of Isengard.",Peter Jackson,,,,,,,
Fight Club,1999,18,139,Drama,8.8,An insomniac office worker and a devil-may-care soap maker form an underground fight club that evolves into much more.,David Fincher,,,,,,,
The Lord of the Rings: The Fellowship of the Ring,2001,8,178,"Action, Adventure, Drama",8.8,A meek Hobbit from the Shire and eight companions set out on a journey to destroy the powerful One Ring and save Middle-earth from the Dark Lord Sauron.,Peter Jackson,,,,,,,
Forrest Gump,1994,12,142,"Drama, Romance",8.8,"The presidencies of Kennedy and Johnson, the Vietnam War, the Watergate scandal and other historical events unfold from the perspective of an Alabama man with an IQ of 75, whose only desire is to be reunited with his childhood sweetheart.",Robert Zemeckis,,,,,,,
"The Good, the Bad and the Ugly",1966,14,148,"Adventure, Western",8.8,A bounty hunting scam joins two men in an uneasy alliance against a third in a race to find a fortune in gold buried in a remote cemetery.,Sergio Leone,,,,,,,
Soorarai Pottru,2020,15,153,Drama,8.7,"Nedumaaran Rajangam ""Maara"" sets out to make the common man fly and in the process takes on the world's most capital intensive industry and several enemies who stand in his way.",Sudha Kongara,,,,,,,
The Matrix,1999,15,136,"Action, Sci-Fi",8.7,"When a beautiful stranger leads computer hacker Neo to a forbidding underworld, he discovers the shocking truth--the life he knows is the elaborate deception of an evil cyber-intelligence.",Lana Wachowski,,,,,,,
Goodfellas,1990,18,145,"Biography, Crime, Drama",8.7,"The story of  and his life in the mob, covering his relationship with his wife Karen Hill and his mob partners Jimmy Conway and Tommy DeVito in the Italian-American crime syndicate.",Martin Scorsese,,,,,,,
Star Wars: Episode V - The Empire Strikes Back,1980,4,124,"Action, Adventure, Fantasy",8.7,"After the Rebels are brutally overpowered by the Empire on the ice planet Hoth, Luke Skywalker begins Jedi training with Yoda, while his friends are pursued across the galaxy by Darth Vader and bounty hunter Boba Fett.",Irvin Kershner,,,,,,,
One Flew Over the Cuckoo's Nest,1975,15,133,Drama,8.7,"A criminal pleads insanity and is admitted to a mental institution, where he rebels against the oppressive nurse and rallies up the scared patients.",Milos Forman,,,,,,,
Top Gun: Maverick,2022,12,130,"Action, Drama",8.6,"After more than thirty years of service as one of the Navy's top aviators, Pete Mitchell is where he belongs, pushing the envelope as a courageous test pilot and dodging the advancement in rank that would ground",Joseph Kosinski,,,,,,,
Interstellar,2014,12,169,"Adventure, Drama, Sci-Fi",8.6,A team of explorers travel through a wormhole in space in an attempt to ensure humanity's survival.,Christopher Nolan,,,,,,,
City of God,2002,18,130,"Crime, Drama",8.6,"In the slums of Rio, two kids' paths diverge as one struggles to become a photographer and the other a kingpin.",Fernando Meirelles,,,,,,,
Spirited Away,2001,8,125,"Animation, Adventure, Family",8.6,"During her family's move to the suburbs, a sullen 10-year-old girl wanders into a world ruled by gods, witches, and spirits, and where humans are changed into beasts.",Hayao Miyazaki,,,,,,,
Saving Private Ryan,1998,15,169,"Drama, War",8.6,"Following the Normandy Landings, a group of U.S. soldiers go behind enemy lines to retrieve a paratrooper whose brothers have been killed in action.",Steven Spielberg,,,,,,,
The Green Mile,1999,18,189,"Crime, Drama, Fantasy",8.6,"The lives of guards on Death Row are affected by one of their charges: a black man accused of child murder and rape, yet who has a mysterious gift.",Frank Darabont,,,,,,,
Life Is Beautiful,1997,8,116,"Comedy, Drama, Romance",8.6,"When an open-minded Jewish waiter and his son become victims of the Holocaust, he uses a perfect mixture of will, humor, and imagination to protect his son from the dangers around their camp.",Roberto Benigni,,,,,,,
Seven,1995,18,127,"Crime, Drama, Mystery",8.6,"Two detectives, a rookie and a veteran, hunt a serial killer who uses the seven deadly sins as his motives.",David Fincher,,,,,,,
Terminator 2: Judgment Day,1991,15,137,"Action, Sci-Fi",8.6,"A cyborg, identical to the one who failed to kill Sarah Connor, must now protect her ten-year-old son John from a more advanced and powerful cyborg.",James Cameron,,,,,,,
The Silence of the Lambs,1991,18,118,"Crime, Drama, Thriller",8.6,"A young F.B.I. cadet must receive the help of an incarcerated and manipulative cannibal killer to help catch another serial killer, a madman who skins his victims.",Jonathan Demme,,,,,,,
Star Wars,1977,4,121,"Action, Adventure, Fantasy",8.6,"Luke Skywalker joins forces with a Jedi Knight, a cocky pilot, a Wookiee and two droids to save the galaxy from the Empire's world-destroying battle station, while also attempting to rescue Princess Leia from the mysterious Darth Vader.",George Lucas,,,,,,,
Harakiri,1962,14,133,"Action, Drama, Mystery",8.6,"When a ronin requesting seppuku at a feudal lord's palace is told of the brutal suicide of another ronin who previously visited, he reveals how their pasts are intertwined - and in doing so challenges the clan's integrity.",Masaki Kobayashi,,,,,,,
Seven Samurai,1954,12,207,"Action, Drama",8.6,"""A veteran samurai, gathers six samurais to protect a village from the cruel bandits. As the samurais teach the natives how to defend themselves, the village is attacked by a pack of 40 bandits.",Akira Kurosawa,,,,,,,
It's a Wonderful Life,1946,4,130,"Drama, Family, Fantasy",8.6,An angel is sent from Heaven to help a desperately frustrated businessman by showing him what life would have been like if he had never existed.,Frank Capra,,,,,,,
Asuran,2019,12,141,"Action, Drama",8.5,"The teenage son of a farmer from an underprivileged caste kills a rich, upper caste landlord. Will the farmer, a loving father and a pacifist by heart, be able to save his hot-blooded son is the rest of the story.",Vetrimaaran,,,,,,,
Parasite,2019,15,132,"Comedy, Drama, Thriller",8.5,Greed and class discrimination threaten the newly formed symbiotic relationship between the wealthy Park family and the destitute Kim clan.,Bong Joon Ho,,,,,,,
Whiplash,2014,15,106,"Drama, Music",8.5,A promising young drummer enrolls at a cut-throat music conservatory where his dreams of greatness are mentored by an instructor who will stop at nothing to realize a student's potential.,Damien Chazelle,,,,,,,
Untouchable,2011,15,112,"Biography, Comedy, Drama",8.5,"After he becomes a quadriplegic from a paragliding accident, an aristocrat hires a young man from the projects to be his caregiver.",Olivier Nakache,,,,,,,
K.G.F: Chapter 2,2022,15,168,"Action, Crime, Drama",8.5,"In the blood-soaked Kolar Gold Fields, Rocky's name strikes fear into his foes. While his allies look up to him, the government sees him as a threat to law and order. Rocky must battle threats from all sides for unchallenged supremacy.",Prashanth Neel,,,,,,,
Sardar Udham,2021,13,164,"Biography, Crime, Drama",8.5,A biopic detailing the 2 decades that Punjabi Sikh revolutionary Udham Singh spent planning the assassination of the man responsible for the Jallianwala Bagh massacre.,Shoojit Sircar,,,,,,,
The Prestige,2006,12,130,"Drama, Mystery, Sci-Fi",8.5,"After a tragic accident, two stage magicians in 1890s London engage in a battle to create the ultimate illusion while sacrificing everything they have to outwit each other.",Christopher Nolan,,,,,,,
The Departed,2006,18,151,"Crime, Drama, Thriller",8.5,An undercover cop and a mole in the police attempt to identify each other while infiltrating an Irish gang in South Boston.,Martin Scorsese,,,,,,,
The Pianist,2002,15,150,"Biography, Drama, Music",8.5,A Polish Jewish musician struggles to survive the destruction of the Warsaw ghetto of World War II.,Roman Polanski,,,,,,,
Gladiator,2000,15,155,"Action, Adventure, Drama",8.5,A former Roman General sets out to exact vengeance against the corrupt emperor who murdered his family and sent him into slavery.,Ridley Scott,,,,,,,
American History X,1998,18,119,"Crime, Drama",8.5,A former neo-nazi skinhead tries to prevent his younger brother from going down the same wrong path that he did.,Tony Kaye,,,,,,,
The Usual Suspects,1995,18,106,"Crime, Drama, Mystery",8.5,"A sole survivor tells of the twisty events leading up to a horrific gun battle on a boat, which began when five criminals met at a seemingly random police lineup.",Bryan Singer,,,,,,,
Leon,1994,18,110,"Action, Crime, Drama",8.5,"12-year-old Mathilda is reluctantly taken in by Léon, a professional assassin, after her family is murdered. An unusual relationship forms as she becomes his protégée and learns the assassin's trade.",Luc Besson,,,,,,,
The Lion King,1994,4,88,"Animation, Adventure, Drama",8.5,"Lion prince Simba and his father are targeted by his bitter uncle, who wants to ascend the throne himself.",Roger Allers,,,,,,,
Cinema Paradiso,1988,8,155,"Drama, Romance",8.5,A filmmaker recalls his childhood when falling in love with the pictures at the cinema of his home village and forms a deep friendship with the cinema's projectionist.,Giuseppe Tornatore,,,,,,,
Grave of the Fireflies,1988,12,89,"Animation, Drama, War",8.5,A young boy and his little sister struggle to survive in Japan during World War II.,Isao Takahata,,,,,,,
Back to the Future,1985,8,116,"Adventure, Comedy, Sci-Fi",8.5,"Marty McFly, a 17-year-old high school student, is accidentally sent thirty years into the past in a time-traveling DeLorean invented by his close friend, the eccentric scientist Doc Brown.",Robert Zemeckis,,,,,,,
Apocalypse Now,1979,14,147,"Drama, Mystery, War",8.5,A U.S. Army officer serving in Vietnam is tasked with assassinating a renegade Special Forces Colonel who sees himself as a god.,Francis Ford Coppola,,,,,,,
Alien,1979,14,117,"Horror, Sci-Fi",8.5,The crew of a commercial spacecraft encounter a deadly lifeform after investigating an unknown transmission.,Ridley Scott,,,,,,,
Once Upon a Time in the West,1968,14,165,Western,8.5,A mysterious stranger with a harmonica joins forces with a notorious desperado to protect a beautiful widow from a ruthless assassin working for the railroad.,Sergio Leone,,,,,,,
Psycho,1960,15,109,"Horror, Mystery, Thriller",8.5,"A Phoenix secretary embezzles $40,000 from her employer's client, goes on the run, and checks into a remote motel run by a young man under the domination of his mother.",Alfred Hitchcock,,,,,,,
Rear Window,1954,12,112,"Mystery, Thriller",8.5,"A wheelchair-bound photographer spies on his neighbors from his Greenwich Village courtyard apartment window, and becomes convinced one of them has committed murder, despite the skepticism of his fashion-model girlfriend.",Alfred Hitchcock,,,,,,,
Casablanca,1942,4,102,"Drama, Romance, War",8.5,A cynical expatriate American cafe owner struggles to decide whether or not to help his former lover and her fugitive husband escape the Nazis in French Morocco.,Michael Curtiz,,,,,,,
Modern Times,1936,4,87,"Comedy, Drama, Romance",8.5,The Tramp struggles to live in modern industrial society with the help of a young homeless woman.,Charles Chaplin,,,,,,,
City Lights,1931,4,87,"Comedy, Drama, Romance",8.5,"With the aid of a wealthy erratic tippler, a dewy-eyed tramp who has fallen in love with a sightless flower girl accumulates money to be able to help her medically.",Charles Chaplin,,,,,,,
Hamilton,2020,12,160,"Biography, Drama, History",8.4,"The real life of one of America's foremost founding fathers and first Secretary of the Treasury, Alexander Hamilton. Captured live on Broadway from the Richard Rodgers Theater with the original Broadway cast.",Thomas Kail,,,,,,,
Capernaum,2018,15,126,Drama,8.4,"While serving a five-year sentence for a violent crime, a 12-year-old boy sues his parents for neglect.",Nadine Labaki,,,,,,,
Joker,2019,15,122,"Crime, Drama, Thriller",8.4,A mentally troubled stand-up comedian embarks on a downward spiral that leads to the creation of an iconic villain.,Todd Phillips,,,,,,,
96,2018,8,158,"Drama, Romance",8.4,Two high school sweethearts meet at a reunion after 22 years and reminisce about their past.,C. Prem Kumar,,,,,,,
Your Name.,2016,12,106,"Animation, Drama, Fantasy",8.4,"Two strangers find themselves linked in a bizarre way. When a connection forms, will distance be the only thing to keep them apart?",Makoto Shinkai,,,,,,,
Spider-Man: Into the Spider-Verse,2018,8,117,"Animation, Action, Adventure",8.4,"Teen Miles Morales becomes the Spider-Man of his universe, and must join with five spider-powered individuals from other dimensions to stop a threat for all realities.",Bob Persichetti,,,,,,,
Avengers: Endgame,2019,12,181,"Action, Adventure, Drama",8.4,"After the devastating events of  (2018), the universe is in ruins. With the help of remaining allies, the Avengers assemble once more in order to reverse Thanos' actions and restore balance to the universe.",Anthony Russo,,,,,,,
Avengers: Infinity War,2018,12,149,"Action, Adventure, Sci-Fi",8.4,The Avengers and their allies must be willing to sacrifice all in an attempt to defeat the powerful Thanos before his blitz of devastation and ruin puts an end to the universe.,Anthony Russo,,,,,,,
Coco,2017,8,105,"Animation, Adventure, Comedy",8.4,"Aspiring musician Miguel, confronted with his family's ancestral ban on music, enters the Land of the Dead to find his great-great-grandfather, a legendary singer.",Lee Unkrich,,,,,,,
Django Unchained,2012,18,165,"Drama, Western",8.4,"With the help of a German bounty-hunter, a freed slave sets out to rescue his wife from a brutal plantation-owner in Mississippi.",Quentin Tarantino,,,,,,,
The Dark Knight Rises,2012,12,164,"Action, Drama",8.4,"Eight years after the Joker's reign of anarchy, Batman, with the help of the enigmatic Catwoman, is forced from his exile to save Gotham City from the brutal guerrilla terrorist Bane.",Christopher Nolan,,,,,,,
Drishyam 2,2021,12,152,"Crime, Drama, Thriller",8.4,A gripping tale of an investigation and a family which is threatened by it. Will Georgekutty be able to protect his family this time?,Jeethu Joseph,,,,,,,
3 Idiots,2009,12,170,"Comedy, Drama",8.4,"Two friends are searching for their long lost companion. They revisit their college days and recall the memories of their friend who inspired them to think differently, even as the rest of the world called them ""idiots"".",Rajkumar Hirani,,,,,,,
Shershaah,2021,4,135,"Action, Biography, Drama",8.4,"The story of PVC awardee Indian soldier Capt. Vikram Batra, who shot to fame and became a household name during the Kargil War in 1999.",Vishnuvardhan,,,,,,,
WALL·E,2008,4,98,"Animation, Adventure, Family",8.4,"In the distant future, a small waste-collecting robot inadvertently embarks on a space journey that will ultimately decide the fate of mankind.",Andrew Stanton,,,,,,,
The Lives of Others,2006,15,137,"Drama, Mystery, Thriller",8.4,"In 1984 East Berlin, an agent of the secret police, conducting surveillance on a writer and his lover, finds himself becoming increasingly absorbed by their lives.",Florian Henckel von Donnersmarck,,,,,,,
Oldboy,2003,18,101,"Action, Drama, Mystery",8.4,"After being kidnapped and imprisoned for fifteen years, Oh Dae-Su is released, only to find that he must find his captor in five days.",Park Chan-wook,,,,,,,
Memento,2000,15,113,"Mystery, Thriller",8.4,A man with short-term memory loss attempts to track down his wife's murderer.,Christopher Nolan,,,,,,,
American Beauty,1999,18,122,Drama,8.4,A sexually frustrated suburban father has a mid-life crisis after becoming infatuated with his daughter's best friend.,Sam Mendes,,,,,,,
Princess Mononoke,1997,8,134,"Animation, Adventure, Fantasy",8.4,"On a journey to find the cure for a Tatarigami's curse, Ashitaka finds himself in the middle of a war between the forest gods and Tatara, a mining colony. In this quest he also meets San, the Mononoke Hime.",Hayao Miyazaki,,,,,,,
Braveheart,1995,15,178,"Biography, Drama, History",8.4,Scottish warrior William Wallace leads his countrymen in a rebellion to free his homeland from the tyranny of King Edward I of England.,Mel Gibson,,,,,,,
Aliens,1986,4,137,"Action, Adventure, Sci-Fi",8.4,"Fifty-seven years after surviving an apocalyptic attack aboard her space vessel by merciless space creatures, Officer Ripley awakens from hyper-sleep and tries to warn anyone who will listen about the predators.",James Cameron,,,,,,,
Amadeus,1984,8,160,"Biography, Drama, Music",8.4,"The life, success and troubles of , as told by , the contemporaneous composer who was insanely jealous of Mozart's talent and claimed to have murdered him.",Milos Forman,,,,,,,
Raiders of the Lost Ark,1981,12,115,"Action, Adventure",8.4,"In 1936, archaeologist and adventurer Indiana Jones is hired by the U.S. government to find the Ark of the Covenant before 's Nazis can obtain its awesome powers.",Steven Spielberg,,,,,,,
Das Boot,1981,14,149,"Drama, War",8.4,"The claustrophobic world of a WWII German U-boat; boredom, filth and sheer terror.",Wolfgang Petersen,,,,,,,
The Shining,1980,15,146,"Drama, Horror",8.4,"A family heads to an isolated hotel for the winter where a sinister presence influences the father into violence, while his psychic son sees horrific forebodings from both past and future.",Stanley Kubrick,,,,,,,
High and Low,1963,12,143,"Crime, Drama, Mystery",8.4,An executive of a Yokohama shoe company becomes a victim of extortion when his chauffeur's son is kidnapped by mistake and held for ransom.,Akira Kurosawa,,,,,,,
Dr. Strangelove or: How I Learned to Stop Worrying and Love the Bomb,1964,12,95,"Comedy, War",8.4,"An insane American general orders a bombing attack on the Soviet Union, triggering a path to nuclear holocaust that a war room full of politicians and generals frantically tries to stop.",Stanley Kubrick,,,,,,,
Witness for the Prosecution,1957,4,116,"Crime, Drama, Mystery",8.4,A veteran British barrister must defend his client in a murder trial that has surprise after surprise.,Billy Wilder,,,,,,,
Paths of Glory,1957,8,88,"Drama, War",8.4,"After refusing to attack an enemy position, a general accuses the soldiers of cowardice and their commanding officer must defend them.",Stanley Kubrick,,,,,,,
Sunset Blvd.,1950,8,110,"Drama, Film-Noir",8.4,A screenwriter develops a dangerous relationship with a faded film star determined to make a triumphant return.,Billy Wilder,,,,,,,
The Great Dictator,1940,4,125,"Comedy, Drama, War",8.4,Dictator Adenoid Hynkel tries to expand his empire while a poor Jewish barber tries to avoid persecution from Hynkel's regime.,Charles Chaplin,,,,,,,
Raatchasan,2018,4,170,"Crime, Drama, Mystery",8.3,A sub-inspector sets out in pursuit of a mysterious serial killer who targets teen school girls and murders them brutally.,Ram Kumar,,,,,,,
Everything Everywhere All at Once,2022,15,139,"Action, Adventure, Comedy",8.3,"An aging Chinese immigrant is swept up in an insane adventure, where she alone can save the world by exploring other universes connecting with the lives she could have led.",Dan Kwan,,,,,,,
Ayla,2017,15,125,"Biography, Drama, History",8.3,"In 1950, amid-st the ravages of the Korean War, Sergeant Süleyman stumbles upon a half-frozen little girl, with no parents and no help in sight. Frantic, scared and on the verge of death, ...                 »",Can Ulkay,,,,,,,
Dangal,2016,8,161,"Action, Biography, Drama",8.3,Former wrestler  and his two wrestler daughters struggle towards glory at the Commonwealth Games in the face of societal oppression.,Nitesh Tiwari,,,,,,,
Drishyam,2013,12,160,"Crime, Drama, Thriller",8.3,A man goes to extreme lengths to save his family from punishment after the family commits an accidental crime.,Jeethu Joseph,,,,,,,
The Hunt,2012,15,115,Drama,8.3,"A teacher lives a lonely life, all the while struggling over his son's custody. His life slowly gets better as he finds love and receives good news from his son, but his new luck is about to be brutally shattered by an innocent little lie.",Thomas Vinterberg,,,,,,,
A Separation,2011,8,123,Drama,8.3,A married couple are faced with a difficult decision - to improve the life of their child by moving to another country or to stay in Iran and look after a deteriorating parent who has Alzheimer's disease.,Asghar Farhadi,,,,,,,
Incendies,2010,15,131,"Drama, Mystery",8.3,Twins journey to the Middle East to discover their family history and fulfill their mother's last wishes.,Denis Villeneuve,,,,,,,
Spider-Man: No Way Home,2021,12,148,"Action, Adventure, Fantasy",8.3,"With Spider-Man's identity now revealed, Peter asks Doctor Strange for help. When a spell goes wrong, dangerous foes from other worlds start to appear, forcing Peter to discover what it truly means to be Spider-Man.",Jon Watts,,,,,,,
Up,2009,4,96,"Animation, Adventure, Comedy",8.3,"78-year-old Carl Fredricksen travels to Paradise Falls in his house equipped with balloons, inadvertently taking a young stowaway.",Pete Docter,,,,,,,
Like Stars on Earth,2007,8,165,"Drama, Family",8.3,"An eight-year-old boy is thought to be a lazy trouble-maker, until the new art teacher has the patience and compassion to discover the real problem behind his struggles in school.",Aamir Khan,,,,,,,
Toy Story 3,2010,4,103,"Animation, Adventure, Comedy",8.3,"The toys are mistakenly delivered to a day-care center instead of the attic right before Andy leaves for college, and it's up to Woody to convince the other toys that they weren't abandoned and to return home.",Lee Unkrich,,,,,,,
Inglourious Basterds,2009,18,153,"Adventure, Drama, War",8.3,"In Nazi-occupied France during World War II, a plan to assassinate Nazi leaders by a group of Jewish U.S. soldiers coincides with a theatre owner's vengeful plans for the same.",Quentin Tarantino,,,,,,,
Eternal Sunshine of the Spotless Mind,2004,15,108,"Drama, Romance, Sci-Fi",8.3,"When their relationship turns sour, a couple undergoes a medical procedure to have each other erased from their memories.",Michel Gondry,,,,,,,
Amélie,2001,15,122,"Comedy, Romance",8.3,"Amélie is an innocent and naive girl in Paris with her own sense of justice. She decides to help those around her and, along the way, discovers love.",Jean-Pierre Jeunet,,,,,,,
Snatch,2000,18,104,"Comedy, Crime",8.3,"Unscrupulous boxing promoters, violent bookmakers, a Russian gangster, incompetent amateur robbers and supposedly Jewish jewelers fight to track down a priceless stolen diamond.",Guy Ritchie,,,,,,,
Requiem for a Dream,2000,18,102,Drama,8.3,The drug-induced utopias of four Coney Island people are shattered when their addictions run deep.,Darren Aronofsky,,,,,,,
Good Will Hunting,1997,15,126,"Drama, Romance",8.3,"Will Hunting, a janitor at M.I.T., has a gift for mathematics, but needs help from a psychologist to find direction in his life.",Gus Van Sant,,,,,,,
Toy Story,1995,8,81,"Animation, Adventure, Comedy",8.3,A cowboy doll is profoundly threatened and jealous when a new spaceman figure supplants him as top toy in a boy's room.,John Lasseter,,,,,,,
